collector,count,percent_total,dollar_amount,count21,percent_total21,dollar_amount21,count20,percent_total20,dollar_amount20
midland credit management inc,152,16.8%,0,20,13.5%,0,132,17.4%,0
lvnv funding llc,142,15.7%,0,40,27.0%,0,102,13.4%,0
portfolio recovery associates llc,118,13.0%,0,7,4.7%,0,111,14.6%,0
cavalry spv i llc,52,5.7%,0,10,6.8%,0,42,5.5%,0
midland funding llc,47,5.2%,0,1,0.7%,0,46,6.1%,0
bank of america n.a.,35,3.9%,0,10,6.8%,0,25,3.3%,0
cass regional medical center,24,2.6%,0,0,0.0%,0,24,3.2%,0
citibank na,20,2.2%,0,1,0.7%,0,19,2.5%,0
capital one bank (usa) n.a.,19,2.1%,0,0,0.0%,0,19,2.5%,0
jp morgan chase bank n.a.,17,1.9%,0,2,1.4%,0,15,2.0%,0
clear recovery inc,16,1.8%,0,0,0.0%,0,16,2.1%,0
td bank usa n.a.,15,1.7%,0,9,6.1%,0,6,0.8%,0
citibank n.a.,14,1.5%,0,3,2.0%,0,11,1.4%,0
metro emergency physicians llc,13,1.4%,0,0,0.0%,0,13,1.7%,0
velocity investments llc,10,1.1%,0,1,0.7%,0,9,1.2%,0
jefferson capital systems llc,10,1.1%,0,1,0.7%,0,9,1.2%,0
discover bank,10,1.1%,0,6,4.1%,0,4,0.5%,0
wakefield & associates inc,9,1.0%,0,2,1.4%,0,7,0.9%,0
absolute resolutions investments llc,9,1.0%,0,2,1.4%,0,7,0.9%,0
credit corp solutions inc,9,1.0%,0,0,0.0%,0,9,1.2%,0
university of kansas health system,6,0.7%,0,0,0.0%,0,6,0.8%,0
cash link usa llc,6,0.7%,0,0,0.0%,0,6,0.8%,0
midland credit management inc a corporation,6,0.7%,0,6,4.1%,0,0,0.0%,0
health care associated emergency physicians,5,0.6%,0,0,0.0%,0,5,0.7%,0
cash link usa llc dba cash link usa,5,0.6%,0,2,1.4%,0,3,0.4%,0
onemain financial group llc successor by merger to,5,0.6%,0,0,0.0%,0,5,0.7%,0
cvi sgp-co acquisition trust,4,0.4%,0,0,0.0%,0,4,0.5%,0
lvnv funding  llc,4,0.4%,0,3,2.0%,0,1,0.1%,0
university of kansas hospital,4,0.4%,0,3,2.0%,0,1,0.1%,0
portfolio recovery assoc.,4,0.4%,0,0,0.0%,0,4,0.5%,0
health care associated emergency physicians llc,3,0.3%,0,0,0.0%,0,3,0.4%,0
barclays bank delaware,3,0.3%,0,0,0.0%,0,3,0.4%,0
onemain financial services llc,3,0.3%,0,0,0.0%,0,3,0.4%,0
genesis health clubs llc,3,0.3%,0,0,0.0%,0,3,0.4%,0
ncb management services,3,0.3%,0,0,0.0%,0,3,0.4%,0
cvi sgp acquisition trust,3,0.3%,0,3,2.0%,0,0,0.0%,0
cash link usa,2,0.2%,0,0,0.0%,0,2,0.3%,0
capital one n.a.,2,0.2%,0,0,0.0%,0,2,0.3%,0
st joseph medical center,2,0.2%,0,0,0.0%,0,2,0.3%,0
lvnv funding llc a limited liability company,2,0.2%,0,0,0.0%,0,2,0.3%,0
genesis health clubs inc,2,0.2%,0,0,0.0%,0,2,0.3%,0
friedrich law office pc,2,0.2%,0,0,0.0%,0,2,0.3%,0
golden valley memorial hospital district,2,0.2%,0,1,0.7%,0,1,0.1%,0
cach llc,2,0.2%,0,0,0.0%,0,2,0.3%,0
pyod llc,2,0.2%,0,0,0.0%,0,2,0.3%,0
graceland university,2,0.2%,0,0,0.0%,0,2,0.3%,0
evergy fka kansas city power and light company,2,0.2%,0,1,0.7%,0,1,0.1%,0
u.s. bank national association,2,0.2%,0,0,0.0%,0,2,0.3%,0
onemain financial group llc,2,0.2%,0,2,1.4%,0,0,0.0%,0
ncb management services inc,2,0.2%,0,0,0.0%,0,2,0.3%,0
north oak financial services inc,2,0.2%,0,1,0.7%,0,1,0.1%,0
crown asset management llc,2,0.2%,0,1,0.7%,0,1,0.1%,0
national collegiate student loan trust 2006-2,2,0.2%,0,2,1.4%,0,0,0.0%,0
onemain financial group llc-no add,1,0.1%,0,1,0.7%,0,0,0.0%,0
city of belton,1,0.1%,0,0,0.0%,0,1,0.1%,0
northwest arkansas hospitals llc dba northwest medical,1,0.1%,0,0,0.0%,0,1,0.1%,0
the board of trustees of north kansas city hospital,1,0.1%,0,0,0.0%,0,1,0.1%,0
cash link llc,1,0.1%,0,0,0.0%,0,1,0.1%,0
health care associated er physicians,1,0.1%,0,0,0.0%,0,1,0.1%,0
foundation finance company,1,0.1%,0,0,0.0%,0,1,0.1%,0
miami county medical center inc,1,0.1%,0,0,0.0%,0,1,0.1%,0
capital one bank (usa) na,1,0.1%,0,0,0.0%,0,1,0.1%,0
star companies inc,1,0.1%,0,0,0.0%,0,1,0.1%,0
osage valley electric cooperative association,1,0.1%,0,0,0.0%,0,1,0.1%,0
swift transportation company,1,0.1%,0,0,0.0%,0,1,0.1%,0
america's car-mart,1,0.1%,0,0,0.0%,0,1,0.1%,0
mgc leasing and property management llc,1,0.1%,0,0,0.0%,0,1,0.1%,0
mm finance llc dba ez money check cashing - no add,1,0.1%,0,0,0.0%,0,1,0.1%,0
world finance corp,1,0.1%,0,0,0.0%,0,1,0.1%,0
sandia resolution company llc,1,0.1%,0,0,0.0%,0,1,0.1%,0
johnson county wastewater,1,0.1%,0,0,0.0%,0,1,0.1%,0
absolute resolutions corporation,1,0.1%,0,0,0.0%,0,1,0.1%,0
jefferson bank of missouri,1,0.1%,0,0,0.0%,0,1,0.1%,0
mason's construction company inc d/b/a screen warehouse,1,0.1%,0,0,0.0%,0,1,0.1%,0
south central kansas city surgical center llc,1,0.1%,0,0,0.0%,0,1,0.1%,0
persolve recoveries llc,1,0.1%,0,0,0.0%,0,1,0.1%,0
johnson county ambulance district,1,0.1%,0,0,0.0%,0,1,0.1%,0
midwest orthopaedics pa,1,0.1%,0,0,0.0%,0,1,0.1%,0
kirksville missouri hospital company l.l.c.,1,0.1%,0,0,0.0%,0,1,0.1%,0
florissant glass company,1,0.1%,0,0,0.0%,0,1,0.1%,0
waste management of missouri inc a corporation,1,0.1%,0,0,0.0%,0,1,0.1%,0
wirken law firm llc,1,0.1%,0,0,0.0%,0,1,0.1%,0
one main financial group llc,1,0.1%,0,0,0.0%,0,1,0.1%,0
capital one bank,1,0.1%,0,0,0.0%,0,1,0.1%,0
lippert mechanical service corporation,1,0.1%,0,0,0.0%,0,1,0.1%,0
department stores national bank,1,0.1%,0,0,0.0%,0,1,0.1%,0
cash in a flash,1,0.1%,0,0,0.0%,0,1,0.1%,0
portfolio recover associates,1,0.1%,0,0,0.0%,0,1,0.1%,0
the metropolitan st louis sewer district,1,0.1%,0,0,0.0%,0,1,0.1%,0
msd,1,0.1%,0,0,0.0%,0,1,0.1%,0
four seasons lakesites poa,1,0.1%,0,0,0.0%,0,1,0.1%,0
four seasons lakesites poa inc,1,0.1%,0,0,0.0%,0,1,0.1%,0
merchant credit adjusters inc,1,0.1%,0,0,0.0%,0,1,0.1%,0
mckesson medical-surgical minnesota supply inc,1,0.1%,0,0,0.0%,0,1,0.1%,0
ols inc,1,0.1%,0,0,0.0%,0,1,0.1%,0
rpcs inc,1,0.1%,0,0,0.0%,0,1,0.1%,0
ceramic technics ltd.,1,0.1%,0,0,0.0%,0,1,0.1%,0
ckc data solutions llc,1,0.1%,0,0,0.0%,0,1,0.1%,0
signature behavioral hospital operations llc,1,0.1%,0,0,0.0%,0,1,0.1%,0
specialty foods distribution inc,1,0.1%,0,0,0.0%,0,1,0.1%,0
city of kansas city missouri,1,0.1%,0,0,0.0%,0,1,0.1%,0
jpmorgan chase bank n.a.,1,0.1%,0,0,0.0%,0,1,0.1%,0
second round sub llc,1,0.1%,0,0,0.0%,0,1,0.1%,0
university of missouri kansas city,1,0.1%,0,0,0.0%,0,1,0.1%,0
student loan solutions llc,1,0.1%,0,0,0.0%,0,1,0.1%,0
ihs lp d/b/a lutheran hospital of indiana,1,0.1%,0,0,0.0%,0,1,0.1%,0
communityamerica credit union,1,0.1%,0,0,0.0%,0,1,0.1%,0
mm finance llc,1,0.1%,0,1,0.7%,0,0,0.0%,0
nevada medical clinic llc,1,0.1%,0,1,0.7%,0,0,0.0%,0
jh met subsidiary b liquidating trust,1,0.1%,0,0,0.0%,0,1,0.1%,0
tbf financial llc,1,0.1%,0,0,0.0%,0,1,0.1%,0
standard battery inc,1,0.1%,0,0,0.0%,0,1,0.1%,0
pca acquisitions v llc,1,0.1%,0,0,0.0%,0,1,0.1%,0
university of kansas  hospital,1,0.1%,0,1,0.7%,0,0,0.0%,0
a&e futures llc,1,0.1%,0,1,0.7%,0,0,0.0%,0
mm finance llc dba ez money check cashing,1,0.1%,0,1,0.7%,0,0,0.0%,0
department store national bank,1,0.1%,0,1,0.7%,0,0,0.0%,0
commercial kitchen services inc,1,0.1%,0,1,0.7%,0,0,0.0%,0killman northeast imports inc a/k/a mazda,1,0.1%,0,0,0.0%,0,1,0.3%,0
lm insurance corporation,1,0.1%,0,0,0.0%,0,1,0.3%,0
porter regional hospital,1,0.1%,0,0,0.0%,0,1,0.3%,0
z z diesel llc,1,0.1%,7296.2,0,0.0%,0,1,0.3%,7296.2
c & f finaance company,1,0.1%,10324.44,0,0.0%,0,1,0.3%,10324.44
horizon bank,1,0.1%,7611.64,0,0.0%,0,1,0.3%,7611.64
portfolio recovery associates llc portfolio recovery associates llc citibank n.a. citibank n.a.

                                
                                    (other),1,0.1%,0,0,0.0%,0,1,0.3%,0
chism kent,1,0.1%,0,0,0.0%,0,1,0.3%,0
indy imaging inc,1,0.1%,0,0,0.0%,0,1,0.3%,0
cvi sgp-co acquisition trust,1,0.1%,0,0,0.0%,0,1,0.3%,0
crm properties,1,0.1%,4642.51,0,0.0%,0,1,0.3%,4642.51
consumer portfolio services inc formerly known as cinsumer portfolio services inc successor iit michiana chrysler dodge jeep,1,0.1%,10630.17,0,0.0%,0,1,0.3%,10630.17
american express national bank fka fsb,1,0.1%,9032.83,1,0.2%,9032.83,0,0.0%,0
brite financial services llc,1,0.1%,0,1,0.2%,0,0,0.0%,0
first financial bank,1,0.1%,30232.54,1,0.2%,30232.54,0,0.0%,0
upgrade pass-thru-trust i series 2018-3,1,0.1%,0,1,0.2%,0,0,0.0%,0
rock creek capital llc,1,0.1%,0,1,0.2%,0,0,0.0%,0
national collegiate student loan trust 2006-2,1,0.1%,0,1,0.2%,0,0,0.0%,0
velocity investments llc assignee of consumer portfolio services inc,1,0.1%,0,1,0.2%,0,0,0.0%,0
hs financial group llc,1,0.1%,5009.32,1,0.2%,5009.32,0,0.0%,0
dnf associates,1,0.1%,1567.7,1,0.2%,1567.7,0,0.0%,0
u.s bank national association d/b/a elan financial services,1,0.1%,0,1,0.2%,0,0,0.0%,0
national collegiate student loan trust 2004-1,1,0.1%,0,1,0.2%,0,0,0.0%,0
oliphant financial llc,1,0.1%,0,1,0.2%,0,0,0.0%,0
world finance company of indiana llc,1,0.1%,0,1,0.2%,0,0,0.0%,0
professional financial services of indiana llc,1,0.1%,0,1,0.2%,0,0,0.0%,0
snow & sauerteig llp,1,0.1%,0,1,0.2%,0,0,0.0%,0
prestige financial services,1,0.1%,0,1,0.2%,0,0,0.0%,0
eagle finance company,1,0.1%,0,1,0.2%,0,0,0.0%,0
wells fargo bank n.a.,1,0.1%,0,1,0.2%,0,0,0.0%,0
merchants acceptance corp,1,0.1%,0,1,0.2%,0,0,0.0%,0
jkj financial services llc,1,0.1%,0,1,0.2%,0,0,0.0%,0
miller's health systems inc,1,0.1%,0,1,0.2%,0,0,0.0%,0
harbin llc as assignee of aaron's inc,1,0.1%,0,1,0.2%,0,0,0.0%,0
portfolio recover associates llc,1,0.1%,0,1,0.2%,0,0,0.0%,0
autovest l.l.c of indiana,1,0.1%,2643.64,1,0.2%,2643.64,0,0.0%,0
first farmers bank & trust,1,0.1%,0,1,0.2%,0,0,0.0%,0
acuity,1,0.1%,0,1,0.2%,0,0,0.0%,0
resurgent receivables llc,1,0.1%,2805.08,1,0.2%,2805.08,0,0.0%,0
campus crest at munci llc,1,0.1%,5993,1,0.2%,5993,0,0.0%,0
creditone llc,1,0.1%,0,1,0.2%,0,0,0.0%,0
security credit services llc,1,0.1%,0,1,0.2%,0,0,0.0%,0
velocity investments llc assignee of lendingclub corporation assignee of webba,1,0.1%,0,1,0.2%,0,0,0.0%,0