collector,count,count21,count20,percent_total,percent_total21,percent_total20,dollar_amount,dollar_amount21,dollar_amount20,dollar_percent_total,dollar_percent_total21,dollar_percent_total20,percent_with_representation,percent_with_representation21,percent_with_representation20,percent_default_judgement,percent_default_judgement21,percent_default_judgement20,percent_case_completed,percent_case_completed21,percent_case_completed20
capital region medical center,214,8,206,27.5%,12.3%,28.9%,0,0,0,0%,0%,0%,2.3%,0.0%,2.4%,35.0%,50.0%,34.5%,100.0%,100.0%,100.0%
lvnv funding llc,92,14,78,11.8%,21.5%,10.9%,0,0,0,0%,0%,0%,0.0%,0.0%,0.0%,51.1%,50.0%,51.3%,94.6%,92.9%,94.9%
portfolio recovery associates llc,78,4,74,10.0%,6.2%,10.4%,0,0,0,0%,0%,0%,6.4%,0.0%,6.8%,37.2%,25.0%,37.8%,96.2%,100.0%,95.9%
midland credit management inc,48,1,47,6.2%,1.5%,6.6%,0,0,0,0%,0%,0%,6.3%,0.0%,6.4%,33.3%,0.0%,34.0%,95.8%,100.0%,95.7%
crmc d/b/a crp and crmc,41,0,41,5.3%,0.0%,5.8%,0,0,0,0%,0%,0%,2.4%,0%,2.4%,34.1%,0%,34.1%,100.0%,0%,100.0%
capital region medical center dba capital region physicians-,27,0,27,3.5%,0.0%,3.8%,0,0,0,0%,0%,0%,0.0%,0%,0.0%,29.6%,0%,29.6%,100.0%,0%,100.0%
midland credit management inc a corporation,21,9,12,2.7%,13.8%,1.7%,0,0,0,0%,0%,0%,0.0%,0.0%,0.0%,42.9%,33.3%,50.0%,95.2%,88.9%,100.0%
cavalry spv i llc,19,3,16,2.4%,4.6%,2.2%,0,0,0,0%,0%,0%,0.0%,0.0%,0.0%,36.8%,33.3%,37.5%,94.7%,100.0%,93.8%
jefferson capital systems llc,15,0,15,1.9%,0.0%,2.1%,0,0,0,0%,0%,0%,0.0%,0%,0.0%,53.3%,0%,53.3%,93.3%,0%,93.3%
midland funding llc,11,0,11,1.4%,0.0%,1.5%,0,0,0,0%,0%,0%,9.1%,0%,9.1%,18.2%,0%,18.2%,81.8%,0%,81.8%
citibank na,11,1,10,1.4%,1.5%,1.4%,0,0,0,0%,0%,0%,18.2%,0.0%,20.0%,18.2%,0.0%,20.0%,100.0%,100.0%,100.0%
metropolitan st louis sewer district,10,0,10,1.3%,0.0%,1.4%,0,0,0,0%,0%,0%,0.0%,0%,0.0%,10.0%,0%,10.0%,90.0%,0%,90.0%
capital one bank (usa) na,9,0,9,1.2%,0.0%,1.3%,0,0,0,0%,0%,0%,0.0%,0%,0.0%,22.2%,0%,22.2%,100.0%,0%,100.0%
td bank usa na,8,4,4,1.0%,6.2%,0.6%,0,0,0,0%,0%,0%,12.5%,25.0%,0.0%,62.5%,75.0%,50.0%,100.0%,100.0%,100.0%
bank of america na,7,1,6,0.9%,1.5%,0.8%,0,0,0,0%,0%,0%,28.6%,0.0%,33.3%,42.9%,100.0%,33.3%,100.0%,100.0%,100.0%
jpmorgan chase bank na,7,0,7,0.9%,0.0%,1.0%,0,0,0,0%,0%,0%,14.3%,0%,14.3%,42.9%,0%,42.9%,100.0%,0%,100.0%
absolute resolutions investments llc,7,0,7,0.9%,0.0%,1.0%,0,0,0,0%,0%,0%,0.0%,0%,0.0%,42.9%,0%,42.9%,100.0%,0%,100.0%
four seasons lakesites poa inc,7,1,6,0.9%,1.5%,0.8%,0,0,0,0%,0%,0%,0.0%,0.0%,0.0%,57.1%,0.0%,66.7%,100.0%,100.0%,100.0%
velocity investments llc,6,0,6,0.8%,0.0%,0.8%,0,0,0,0%,0%,0%,0.0%,0%,0.0%,50.0%,0%,50.0%,100.0%,0%,100.0%
consumer collection management inc,5,1,4,0.6%,1.5%,0.6%,0,0,0,0%,0%,0%,0.0%,0.0%,0.0%,40.0%,0.0%,50.0%,100.0%,100.0%,100.0%
ncb management services inc,5,0,5,0.6%,0.0%,0.7%,0,0,0,0%,0%,0%,0.0%,0%,0.0%,80.0%,0%,80.0%,100.0%,0%,100.0%
central trust bank,4,0,4,0.5%,0.0%,0.6%,0,0,0,0%,0%,0%,0.0%,0%,0.0%,50.0%,0%,50.0%,100.0%,0%,100.0%
onemain financial group llc,4,0,4,0.5%,0.0%,0.6%,0,0,0,0%,0%,0%,25.0%,0%,25.0%,25.0%,0%,25.0%,75.0%,0%,75.0%
laubert's auto sales llc,4,1,3,0.5%,1.5%,0.4%,0,0,0,0%,0%,0%,0.0%,0.0%,0.0%,75.0%,100.0%,66.7%,100.0%,100.0%,100.0%
credit corp solutions inc,4,0,4,0.5%,0.0%,0.6%,0,0,0,0%,0%,0%,0.0%,0%,0.0%,50.0%,0%,50.0%,75.0%,0%,75.0%
maries osage ambulance district,4,0,4,0.5%,0.0%,0.6%,0,0,0,0%,0%,0%,0.0%,0%,0.0%,25.0%,0%,25.0%,100.0%,0%,100.0%
consumer adjustment company inc,3,1,2,0.4%,1.5%,0.3%,0,0,0,0%,0%,0%,33.3%,0.0%,50.0%,0.0%,0.0%,0.0%,100.0%,100.0%,100.0%
wakefield & associates inc,2,0,2,0.3%,0.0%,0.3%,0,0,0,0%,0%,0%,0.0%,0%,0.0%,0.0%,0%,0.0%,100.0%,0%,100.0%
barclays bank delaware,2,0,2,0.3%,0.0%,0.3%,0,0,0,0%,0%,0%,50.0%,0%,50.0%,50.0%,0%,50.0%,100.0%,0%,100.0%
cvi sgp acquisition trust,2,0,2,0.3%,0.0%,0.3%,0,0,0,0%,0%,0%,0.0%,0%,0.0%,50.0%,0%,50.0%,100.0%,0%,100.0%
consumer collection management as assignee of crmc,2,0,2,0.3%,0.0%,0.3%,0,0,0,0%,0%,0%,0.0%,0%,0.0%,50.0%,0%,50.0%,100.0%,0%,100.0%
account resolution corporation as assignee of capital region,2,0,2,0.3%,0.0%,0.3%,0,0,0,0%,0%,0%,0.0%,0%,0.0%,0.0%,0%,0.0%,50.0%,0%,50.0%
the central trust bank,2,0,2,0.3%,0.0%,0.3%,0,0,0,0%,0%,0%,0.0%,0%,0.0%,50.0%,0%,50.0%,100.0%,0%,100.0%
lohman producers exchange inc,2,0,2,0.3%,0.0%,0.3%,0,0,0,0%,0%,0%,0.0%,0%,0.0%,0.0%,0%,0.0%,100.0%,0%,100.0%
little hills healthcare inc,2,0,2,0.3%,0.0%,0.3%,0,0,0,0%,0%,0%,50.0%,0%,50.0%,50.0%,0%,50.0%,100.0%,0%,100.0%
cash link usa llc,2,0,2,0.3%,0.0%,0.3%,0,0,0,0%,0%,0%,0.0%,0%,0.0%,100.0%,0%,100.0%,100.0%,0%,100.0%
msd,2,0,2,0.3%,0.0%,0.3%,0,0,0,0%,0%,0%,0.0%,0%,0.0%,0.0%,0%,0.0%,100.0%,0%,100.0%
young's garage & towing petitioner,2,0,2,0.3%,0.0%,0.3%,0,0,0,0%,0%,0%,0.0%,0%,0.0%,0.0%,0%,0.0%,100.0%,0%,100.0%
evergy fka kansas city power & light co,2,1,1,0.3%,1.5%,0.1%,0,0,0,0%,0%,0%,0.0%,0.0%,0.0%,50.0%,100.0%,0.0%,100.0%,100.0%,100.0%
no plaintiff found,1,1,0,0.1%,1.5%,0.0%,0,0,0,0%,0%,0%,0.0%,0.0%,0%,0.0%,0.0%,0%,0.0%,0.0%,0%
federated mutual insurance co.,1,0,1,0.1%,0.0%,0.1%,0,0,0,0%,0%,0%,100.0%,0%,100.0%,0.0%,0%,0.0%,100.0%,0%,100.0%
moberly hospital company llc d/b/a moberly regional medical,1,0,1,0.1%,0.0%,0.1%,0,0,0,0%,0%,0%,0.0%,0%,0.0%,0.0%,0%,0.0%,100.0%,0%,100.0%
moberly hospital company llc,1,0,1,0.1%,0.0%,0.1%,0,0,0,0%,0%,0%,0.0%,0%,0.0%,0.0%,0%,0.0%,100.0%,0%,100.0%
community point bank f/k/a community bank of russellville,1,0,1,0.1%,0.0%,0.1%,0,0,0,0%,0%,0%,0.0%,0%,0.0%,100.0%,0%,100.0%,100.0%,0%,100.0%
berlin-wheeler inc a/a/o capital region medical center,1,0,1,0.1%,0.0%,0.1%,0,0,0,0%,0%,0%,0.0%,0%,0.0%,100.0%,0%,100.0%,100.0%,0%,100.0%
commerce bank a mo banking corp,1,0,1,0.1%,0.0%,0.1%,0,0,0,0%,0%,0%,0.0%,0%,0.0%,100.0%,0%,100.0%,100.0%,0%,100.0%
account resolution corporation a/a/o cap reg med ctr,1,0,1,0.1%,0.0%,0.1%,0,0,0,0%,0%,0%,0.0%,0%,0.0%,0.0%,0%,0.0%,100.0%,0%,100.0%
washington university physicians network,1,0,1,0.1%,0.0%,0.1%,0,0,0,0%,0%,0%,0.0%,0%,0.0%,0.0%,0%,0.0%,100.0%,0%,100.0%
archerfield funding llc,1,0,1,0.1%,0.0%,0.1%,0,0,0,0%,0%,0%,0.0%,0%,0.0%,100.0%,0%,100.0%,100.0%,0%,100.0%
credit bureau of columbia inc,1,0,1,0.1%,0.0%,0.1%,0,0,0,0%,0%,0%,0.0%,0%,0.0%,0.0%,0%,0.0%,100.0%,0%,100.0%
united healthcare insurance company,1,0,1,0.1%,0.0%,0.1%,0,0,0,0%,0%,0%,0.0%,0%,0.0%,0.0%,0%,0.0%,100.0%,0%,100.0%
tuscany village llc,1,0,1,0.1%,0.0%,0.1%,0,0,0,0%,0%,0%,0.0%,0%,0.0%,0.0%,0%,0.0%,100.0%,0%,100.0%
central bank of boone county,1,0,1,0.1%,0.0%,0.1%,0,0,0,0%,0%,0%,0.0%,0%,0.0%,0.0%,0%,0.0%,100.0%,0%,100.0%
poplar bluff regional medical center,1,0,1,0.1%,0.0%,0.1%,0,0,0,0%,0%,0%,0.0%,0%,0.0%,0.0%,0%,0.0%,100.0%,0%,100.0%
womens wellness center inc,1,0,1,0.1%,0.0%,0.1%,0,0,0,0%,0%,0%,0.0%,0%,0.0%,0.0%,0%,0.0%,100.0%,0%,100.0%
kirksville missouri hospital company llc dba northeast regio,1,0,1,0.1%,0.0%,0.1%,0,0,0,0%,0%,0%,0.0%,0%,0.0%,100.0%,0%,100.0%,100.0%,0%,100.0%
pay way feed store,1,0,1,0.1%,0.0%,0.1%,0,0,0,0%,0%,0%,0.0%,0%,0.0%,0.0%,0%,0.0%,100.0%,0%,100.0%
mm finance a nebraska limited liability company,1,0,1,0.1%,0.0%,0.1%,0,0,0,0%,0%,0%,0.0%,0%,0.0%,100.0%,0%,100.0%,100.0%,0%,100.0%
st louis university -ngrand,1,0,1,0.1%,0.0%,0.1%,0,0,0,0%,0%,0%,0.0%,0%,0.0%,0.0%,0%,0.0%,100.0%,0%,100.0%
paul n. cardon dds llc d/b/a stadium dental center,1,0,1,0.1%,0.0%,0.1%,0,0,0,0%,0%,0%,0.0%,0%,0.0%,100.0%,0%,100.0%,100.0%,0%,100.0%
republic services inc,1,0,1,0.1%,0.0%,0.1%,0,0,0,0%,0%,0%,0.0%,0%,0.0%,0.0%,0%,0.0%,100.0%,0%,100.0%
amg inc d/b/a esse health,1,0,1,0.1%,0.0%,0.1%,0,0,0,0%,0%,0%,0.0%,0%,0.0%,100.0%,0%,100.0%,100.0%,0%,100.0%
osage ambulance district,1,0,1,0.1%,0.0%,0.1%,0,0,0,0%,0%,0%,0.0%,0%,0.0%,100.0%,0%,100.0%,100.0%,0%,100.0%
first mercy insurance company,1,0,1,0.1%,0.0%,0.1%,0,0,0,0%,0%,0%,0.0%,0%,0.0%,0.0%,0%,0.0%,100.0%,0%,100.0%
john j. connell co inc,1,0,1,0.1%,0.0%,0.1%,0,0,0,0%,0%,0%,0.0%,0%,0.0%,0.0%,0%,0.0%,100.0%,0%,100.0%
kansas city power & light company,1,0,1,0.1%,0.0%,0.1%,0,0,0,0%,0%,0%,0.0%,0%,0.0%,100.0%,0%,100.0%,100.0%,0%,100.0%
tech electronics a corporation,1,0,1,0.1%,0.0%,0.1%,0,0,0,0%,0%,0%,100.0%,0%,100.0%,100.0%,0%,100.0%,100.0%,0%,100.0%
missouri employers mutual insurance company,1,0,1,0.1%,0.0%,0.1%,0,0,0,0%,0%,0%,0.0%,0%,0.0%,100.0%,0%,100.0%,100.0%,0%,100.0%
ste. genevieve county memorial hosp.,1,0,1,0.1%,0.0%,0.1%,0,0,0,0%,0%,0%,0.0%,0%,0.0%,100.0%,0%,100.0%,100.0%,0%,100.0%
lf staffing service inc,1,0,1,0.1%,0.0%,0.1%,0,0,0,0%,0%,0%,0.0%,0%,0.0%,100.0%,0%,100.0%,100.0%,0%,100.0%
young's garage & towing petitioner acting pro se,1,0,1,0.1%,0.0%,0.1%,0,0,0,0%,0%,0%,0.0%,0%,0.0%,0.0%,0%,0.0%,100.0%,0%,100.0%
hutton john thomasjr petitioner acting pro se,1,0,1,0.1%,0.0%,0.1%,0,0,0,0%,0%,0%,0.0%,0%,0.0%,0.0%,0%,0.0%,100.0%,0%,100.0%
wilson joshua t petitioner,1,0,1,0.1%,0.0%,0.1%,0,0,0,0%,0%,0%,0.0%,0%,0.0%,0.0%,0%,0.0%,100.0%,0%,100.0%
juarez darlene petitioner,1,0,1,0.1%,0.0%,0.1%,0,0,0,0%,0%,0%,0.0%,0%,0.0%,0.0%,0%,0.0%,100.0%,0%,100.0%
lewis tasha renee petitioner acting pro se,1,0,1,0.1%,0.0%,0.1%,0,0,0,0%,0%,0%,0.0%,0%,0.0%,0.0%,0%,0.0%,100.0%,0%,100.0%
chandler bradley dale petitioner acting pro se,1,0,1,0.1%,0.0%,0.1%,0,0,0,0%,0%,0%,0.0%,0%,0.0%,0.0%,0%,0.0%,100.0%,0%,100.0%
ratliff richard l petitioner acting pro se,1,0,1,0.1%,0.0%,0.1%,0,0,0,0%,0%,0%,0.0%,0%,0.0%,0.0%,0%,0.0%,100.0%,0%,100.0%
southside mfa petitioner acting pro se,1,0,1,0.1%,0.0%,0.1%,0,0,0,0%,0%,0%,0.0%,0%,0.0%,0.0%,0%,0.0%,100.0%,0%,100.0%
gamble ricky duane petitioner acting pro se,1,0,1,0.1%,0.0%,0.1%,0,0,0,0%,0%,0%,0.0%,0%,0.0%,0.0%,0%,0.0%,100.0%,0%,100.0%
newman alicia dawn petitioner,1,0,1,0.1%,0.0%,0.1%,0,0,0,0%,0%,0%,0.0%,0%,0.0%,0.0%,0%,0.0%,100.0%,0%,100.0%
pettijohn auto center inc petitioner,1,0,1,0.1%,0.0%,0.1%,0,0,0,0%,0%,0%,0.0%,0%,0.0%,0.0%,0%,0.0%,100.0%,0%,100.0%
southside mfa petitioner,1,0,1,0.1%,0.0%,0.1%,0,0,0,0%,0%,0%,0.0%,0%,0.0%,0.0%,0%,0.0%,100.0%,0%,100.0%
rinehart auto sales petitioner,1,0,1,0.1%,0.0%,0.1%,0,0,0,0%,0%,0%,0.0%,0%,0.0%,0.0%,0%,0.0%,100.0%,0%,100.0%
hutton john thomasjr petitioner,1,0,1,0.1%,0.0%,0.1%,0,0,0,0%,0%,0%,0.0%,0%,0.0%,0.0%,0%,0.0%,100.0%,0%,100.0%
baker joey l petitioner,1,0,1,0.1%,0.0%,0.1%,0,0,0,0%,0%,0%,0.0%,0%,0.0%,0.0%,0%,0.0%,100.0%,0%,100.0%
teel darrell e petitioner,1,0,1,0.1%,0.0%,0.1%,0,0,0,0%,0%,0%,0.0%,0%,0.0%,0.0%,0%,0.0%,100.0%,0%,100.0%
billups james willard petitioner,1,0,1,0.1%,0.0%,0.1%,0,0,0,0%,0%,0%,0.0%,0%,0.0%,0.0%,0%,0.0%,100.0%,0%,100.0%
department stores national bank,1,0,1,0.1%,0.0%,0.1%,0,0,0,0%,0%,0%,0.0%,0%,0.0%,0.0%,0%,0.0%,100.0%,0%,100.0%
hf acquisition co. llc,1,0,1,0.1%,0.0%,0.1%,0,0,0,0%,0%,0%,0.0%,0%,0.0%,0.0%,0%,0.0%,100.0%,0%,100.0%
jh met subsidiary b liquidating trust,1,0,1,0.1%,0.0%,0.1%,0,0,0,0%,0%,0%,0.0%,0%,0.0%,100.0%,0%,100.0%,100.0%,0%,100.0%
bank of america charlotte nc,1,0,1,0.1%,0.0%,0.1%,0,0,0,0%,0%,0%,0.0%,0%,0.0%,0.0%,0%,0.0%,100.0%,0%,100.0%
crown asset management llc,1,0,1,0.1%,0.0%,0.1%,0,0,0,0%,0%,0%,0.0%,0%,0.0%,0.0%,0%,0.0%,100.0%,0%,100.0%
national collegiate student loan trust 2007-1,1,0,1,0.1%,0.0%,0.1%,0,0,0,0%,0%,0%,100.0%,0%,100.0%,0.0%,0%,0.0%,100.0%,0%,100.0%
capital regional medical center,1,1,0,0.1%,1.5%,0.0%,0,0,0,0%,0%,0%,0.0%,0.0%,0%,0.0%,0.0%,0%,100.0%,100.0%,0%
mm finance llc,1,1,0,0.1%,1.5%,0.0%,0,0,0,0%,0%,0%,0.0%,0.0%,0%,0.0%,0.0%,0%,100.0%,100.0%,0%
jp morgan chase,1,1,0,0.1%,1.5%,0.0%,0,0,0,0%,0%,0%,0.0%,0.0%,0%,0.0%,0.0%,0%,100.0%,100.0%,0%
the sherwin-williams company,1,0,1,0.1%,0.0%,0.1%,0,0,0,0%,0%,0%,0.0%,0%,0.0%,0.0%,0%,0.0%,100.0%,0%,100.0%
tbf financial llc,1,1,0,0.1%,1.5%,0.0%,0,0,0,0%,0%,0%,0.0%,0.0%,0%,0.0%,0.0%,0%,100.0%,100.0%,0%
baker distributing company,1,0,1,0.1%,0.0%,0.1%,0,0,0,0%,0%,0%,0.0%,0%,0.0%,100.0%,0%,100.0%,100.0%,0%,100.0%
northern tier retail  llc,1,0,1,0.1%,0.0%,0.1%,0,0,0,0%,0%,0%,0.0%,0%,0.0%,100.0%,0%,100.0%,100.0%,0%,100.0%
hd supply facilities maintenance ltd,1,0,1,0.1%,0.0%,0.1%,0,0,0,0%,0%,0%,0.0%,0%,0.0%,100.0%,0%,100.0%,100.0%,0%,100.0%
berlin-wheeler inc,1,0,1,0.1%,0.0%,0.1%,0,0,0,0%,0%,0%,0.0%,0%,0.0%,0.0%,0%,0.0%,100.0%,0%,100.0%
paycor inc,1,0,1,0.1%,0.0%,0.1%,0,0,0,0%,0%,0%,0.0%,0%,0.0%,100.0%,0%,100.0%,100.0%,0%,100.0%
cach llc,1,0,1,0.1%,0.0%,0.1%,0,0,0,0%,0%,0%,0.0%,0%,0.0%,0.0%,0%,0.0%,100.0%,0%,100.0%
bandre hunt & snider llc,1,0,1,0.1%,0.0%,0.1%,0,0,0,0%,0%,0%,0.0%,0%,0.0%,0.0%,0%,0.0%,0.0%,0%,0.0%
abeo footwear inc,1,0,1,0.1%,0.0%,0.1%,0,0,0,0%,0%,0%,100.0%,0%,100.0%,0.0%,0%,0.0%,0.0%,0%,0.0%
ccm inc as assignee of capital region medical center,1,0,1,0.1%,0.0%,0.1%,0,0,0,0%,0%,0%,0.0%,0%,0.0%,0.0%,0%,0.0%,100.0%,0%,100.0%
auto-owners insurance company,1,0,1,0.1%,0.0%,0.1%,0,0,0,0%,0%,0%,0.0%,0%,0.0%,100.0%,0%,100.0%,100.0%,0%,100.0%
freeman health system,1,0,1,0.1%,0.0%,0.1%,0,0,0,0%,0%,0%,0.0%,0%,0.0%,0.0%,0%,0.0%,100.0%,0%,100.0%
pca acquisitions v llc,1,0,1,0.1%,0.0%,0.1%,0,0,0,0%,0%,0%,0.0%,0%,0.0%,0.0%,0%,0.0%,100.0%,0%,100.0%
pittsburg universal llc,1,0,1,0.1%,0.0%,0.1%,0,0,0,0%,0%,0%,0.0%,0%,0.0%,0.0%,0%,0.0%,0.0%,0%,0.0%
comfort systems usa midsouth inc,1,1,0,0.1%,1.5%,0.0%,0,0,0,0%,0%,0%,0.0%,0.0%,0%,100.0%,100.0%,0%,100.0%,100.0%,0%
american tire distributor,1,0,1,0.1%,0.0%,0.1%,0,0,0,0%,0%,0%,100.0%,0%,100.0%,0.0%,0%,0.0%,0.0%,0%,0.0%
lexington development inc,1,1,0,0.1%,1.5%,0.0%,0,0,0,0%,0%,0%,100.0%,100.0%,0%,0.0%,0.0%,0%,0.0%,0.0%,0%
the central trust bank d/b/a central bank,1,1,0,0.1%,1.5%,0.0%,0,0,0,0%,0%,0%,0.0%,0.0%,0%,100.0%,100.0%,0%,100.0%,100.0%,0%
hydromat inc,1,1,0,0.1%,1.5%,0.0%,0,0,0,0%,0%,0%,100.0%,100.0%,0%,0.0%,0.0%,0%,0.0%,0.0%,0%
crmc and capital region medical,1,1,0,0.1%,1.5%,0.0%,0,0,0,0%,0%,0%,0.0%,0.0%,0%,100.0%,100.0%,0%,100.0%,100.0%,0%
provider plus inc,1,1,0,0.1%,1.5%,0.0%,0,0,0,0%,0%,0%,0.0%,0.0%,0%,100.0%,100.0%,0%,100.0%,100.0%,0%
cvi sgp-co acquisition trust,1,1,0,0.1%,1.5%,0.0%,0,0,0,0%,0%,0%,0.0%,0.0%,0%,0.0%,0.0%,0%,0.0%,0.0%,0%
commercial kitchen services inc a corp.,1,1,0,0.1%,1.5%,0.0%,0,0,0,0%,0%,0%,0.0%,0.0%,0%,100.0%,100.0%,0%,100.0%,100.0%,0%
job finders employment services co / broadway,1,1,0,0.1%,1.5%,0.0%,0,0,0,0%,0%,0%,0.0%,0.0%,0%,0.0%,0.0%,0%,100.0%,100.0%,0%
hittner grant a,1,1,0,0.1%,1.5%,0.0%,0,0,0,0%,0%,0%,0.0%,0.0%,0%,0.0%,0.0%,0%,0.0%,0.0%,0%