collector,count,percent_total,dollar_amount,count21,percent_total21,dollar_amount21,count20,percent_total20,dollar_amount20
capital region medical center,214,27.5%,0,8,12.5%,0,206,28.9%,0
lvnv funding llc,92,11.8%,0,14,21.9%,0,78,10.9%,0
portfolio recovery associates llc,78,10.0%,0,4,6.3%,0,74,10.4%,0
midland credit management inc,47,6.0%,0,1,1.6%,0,46,6.5%,0
crmc d/b/a crp and crmc,41,5.3%,0,0,0.0%,0,41,5.8%,0
capital region medical center dba capital region physicians-,27,3.5%,0,0,0.0%,0,27,3.8%,0
midland credit management inc a corporation,21,2.7%,0,9,14.1%,0,12,1.7%,0
cavalry spv i llc,19,2.4%,0,3,4.7%,0,16,2.2%,0
jefferson capital systems llc,15,1.9%,0,0,0.0%,0,15,2.1%,0
midland funding llc,11,1.4%,0,0,0.0%,0,11,1.5%,0
capital one bank (usa) n.a.,9,1.2%,0,0,0.0%,0,9,1.3%,0
citibank na,9,1.2%,0,1,1.6%,0,8,1.1%,0
metropolitan st louis sewer district,9,1.2%,0,0,0.0%,0,9,1.3%,0
td bank usa n.a.,8,1.0%,0,4,6.3%,0,4,0.6%,0
bank of america na,7,0.9%,0,1,1.6%,0,6,0.8%,0
jpmorgan chase bank n.a.,7,0.9%,0,0,0.0%,0,7,1.0%,0
absolute resolutions investments llc,7,0.9%,0,0,0.0%,0,7,1.0%,0
four seasons lakesites poa inc,7,0.9%,0,1,1.6%,0,6,0.8%,0
velocity investments llc,6,0.8%,0,0,0.0%,0,6,0.8%,0
consumer collection management inc,5,0.6%,0,1,1.6%,0,4,0.6%,0
ncb management services inc,5,0.6%,0,0,0.0%,0,5,0.7%,0
central trust bank,4,0.5%,0,0,0.0%,0,4,0.6%,0
onemain financial group llc,4,0.5%,0,0,0.0%,0,4,0.6%,0
laubert's auto sales llc,4,0.5%,0,1,1.6%,0,3,0.4%,0
credit corp solutions inc,4,0.5%,0,0,0.0%,0,4,0.6%,0
maries osage ambulance district,4,0.5%,0,0,0.0%,0,4,0.6%,0
consumer adjustment company inc,3,0.4%,0,1,1.6%,0,2,0.3%,0
barclays bank delaware,2,0.3%,0,0,0.0%,0,2,0.3%,0
cvi sgp acquisition trust,2,0.3%,0,0,0.0%,0,2,0.3%,0
consumer collection management as assignee of crmc,2,0.3%,0,0,0.0%,0,2,0.3%,0
account resolution corporation as assignee of capital region,2,0.3%,0,0,0.0%,0,2,0.3%,0
the central trust bank,2,0.3%,0,0,0.0%,0,2,0.3%,0
lohman producers exchange inc,2,0.3%,0,0,0.0%,0,2,0.3%,0
little hills healthcare inc,2,0.3%,0,0,0.0%,0,2,0.3%,0
citibank n.a.,2,0.3%,0,0,0.0%,0,2,0.3%,0
cash link usa llc,2,0.3%,0,0,0.0%,0,2,0.3%,0
msd,2,0.3%,0,0,0.0%,0,2,0.3%,0
young's garage & towing petitioner,2,0.3%,0,0,0.0%,0,2,0.3%,0
evergy fka kansas city power & light co,2,0.3%,0,1,1.6%,0,1,0.1%,0
federated mutual insurance co.,1,0.1%,0,0,0.0%,0,1,0.1%,0
wakefield & associates inc,1,0.1%,0,0,0.0%,0,1,0.1%,0
moberly hospital company llc d/b/a moberly regional medical,1,0.1%,0,0,0.0%,0,1,0.1%,0
moberly hospital company llc,1,0.1%,0,0,0.0%,0,1,0.1%,0
community point bank f/k/a community bank of russellville,1,0.1%,0,0,0.0%,0,1,0.1%,0
berlin-wheeler inc a/a/o capital region medical center,1,0.1%,0,0,0.0%,0,1,0.1%,0
commerce bank a mo banking corp,1,0.1%,0,0,0.0%,0,1,0.1%,0
account resolution corporation a/a/o cap reg med ctr,1,0.1%,0,0,0.0%,0,1,0.1%,0
washington university physicians network,1,0.1%,0,0,0.0%,0,1,0.1%,0
archerfield funding llc,1,0.1%,0,0,0.0%,0,1,0.1%,0
credit bureau of columbia inc,1,0.1%,0,0,0.0%,0,1,0.1%,0
united healthcare insurance company,1,0.1%,0,0,0.0%,0,1,0.1%,0
tuscany village llc,1,0.1%,0,0,0.0%,0,1,0.1%,0
central bank of boone county,1,0.1%,0,0,0.0%,0,1,0.1%,0
poplar bluff regional medical center,1,0.1%,0,0,0.0%,0,1,0.1%,0
womens wellness center inc,1,0.1%,0,0,0.0%,0,1,0.1%,0
kirksville missouri hospital company llc dba northeast regio,1,0.1%,0,0,0.0%,0,1,0.1%,0
pay way feed store,1,0.1%,0,0,0.0%,0,1,0.1%,0
mm finance a nebraska limited liability company,1,0.1%,0,0,0.0%,0,1,0.1%,0
st louis university -ngrand,1,0.1%,0,0,0.0%,0,1,0.1%,0
paul n. cardon dds llc d/b/a stadium dental center,1,0.1%,0,0,0.0%,0,1,0.1%,0
republic services inc,1,0.1%,0,0,0.0%,0,1,0.1%,0
amg  inc d/b/a esse health,1,0.1%,0,0,0.0%,0,1,0.1%,0
midland credit management llc,1,0.1%,0,0,0.0%,0,1,0.1%,0
osage ambulance district,1,0.1%,0,0,0.0%,0,1,0.1%,0
first mercy insurance company,1,0.1%,0,0,0.0%,0,1,0.1%,0
wakefield &  associates inc,1,0.1%,0,0,0.0%,0,1,0.1%,0
john j. connell co inc,1,0.1%,0,0,0.0%,0,1,0.1%,0
kansas city power & light company,1,0.1%,0,0,0.0%,0,1,0.1%,0
tech electronics a corporation,1,0.1%,0,0,0.0%,0,1,0.1%,0
missouri employers mutual insurance company,1,0.1%,0,0,0.0%,0,1,0.1%,0
ste. genevieve county memorial hosp.,1,0.1%,0,0,0.0%,0,1,0.1%,0
lf staffing service inc,1,0.1%,0,0,0.0%,0,1,0.1%,0
young's garage & towing petitioner acting pro se,1,0.1%,0,0,0.0%,0,1,0.1%,0
hutton john thomasjr petitioner acting pro se,1,0.1%,0,0,0.0%,0,1,0.1%,0
wilson joshua t petitioner,1,0.1%,0,0,0.0%,0,1,0.1%,0
juarez darlene petitioner,1,0.1%,0,0,0.0%,0,1,0.1%,0
lewis tasha renee petitioner acting pro se,1,0.1%,0,0,0.0%,0,1,0.1%,0
chandler bradley dale petitioner acting pro se,1,0.1%,0,0,0.0%,0,1,0.1%,0
ratliff richard l petitioner acting pro se,1,0.1%,0,0,0.0%,0,1,0.1%,0
southside mfa petitioner acting pro se,1,0.1%,0,0,0.0%,0,1,0.1%,0
gamble ricky duane petitioner acting pro se,1,0.1%,0,0,0.0%,0,1,0.1%,0
newman alicia dawn petitioner,1,0.1%,0,0,0.0%,0,1,0.1%,0
pettijohn auto center inc petitioner,1,0.1%,0,0,0.0%,0,1,0.1%,0
southside mfa petitioner,1,0.1%,0,0,0.0%,0,1,0.1%,0
rinehart auto sales petitioner,1,0.1%,0,0,0.0%,0,1,0.1%,0
hutton john thomasjr petitioner,1,0.1%,0,0,0.0%,0,1,0.1%,0
baker joey l petitioner,1,0.1%,0,0,0.0%,0,1,0.1%,0
teel darrell e petitioner,1,0.1%,0,0,0.0%,0,1,0.1%,0
billups james willard petitioner,1,0.1%,0,0,0.0%,0,1,0.1%,0
department stores national bank,1,0.1%,0,0,0.0%,0,1,0.1%,0
hf acquisition co. llc,1,0.1%,0,0,0.0%,0,1,0.1%,0
jh met subsidiary b liquidating trust,1,0.1%,0,0,0.0%,0,1,0.1%,0
bank of america charlotte nc,1,0.1%,0,0,0.0%,0,1,0.1%,0
crown asset management llc,1,0.1%,0,0,0.0%,0,1,0.1%,0
national collegiate student loan trust 2007-1,1,0.1%,0,0,0.0%,0,1,0.1%,0
capital regional medical center,1,0.1%,0,1,1.6%,0,0,0.0%,0
mm finance llc,1,0.1%,0,1,1.6%,0,0,0.0%,0
jp morgan chase,1,0.1%,0,1,1.6%,0,0,0.0%,0
the sherwin-williams company,1,0.1%,0,0,0.0%,0,1,0.1%,0
tbf financial llc,1,0.1%,0,1,1.6%,0,0,0.0%,0
baker distributing company,1,0.1%,0,0,0.0%,0,1,0.1%,0
metropolitan st. louis sewer district,1,0.1%,0,0,0.0%,0,1,0.1%,0
northern tier  retail  llc,1,0.1%,0,0,0.0%,0,1,0.1%,0
hd supply facilities maintenance ltd,1,0.1%,0,0,0.0%,0,1,0.1%,0
berlin-wheeler inc,1,0.1%,0,0,0.0%,0,1,0.1%,0
paycor inc,1,0.1%,0,0,0.0%,0,1,0.1%,0
cach llc,1,0.1%,0,0,0.0%,0,1,0.1%,0
bandre hunt & snider llc,1,0.1%,0,0,0.0%,0,1,0.1%,0
abeo footwear inc,1,0.1%,0,0,0.0%,0,1,0.1%,0
ccm inc as assignee of capital region medical center,1,0.1%,0,0,0.0%,0,1,0.1%,0
auto-owners insurance company,1,0.1%,0,0,0.0%,0,1,0.1%,0
freeman health system,1,0.1%,0,0,0.0%,0,1,0.1%,0
pca acquisitions v llc,1,0.1%,0,0,0.0%,0,1,0.1%,0
pittsburg universal l.l.c.,1,0.1%,0,0,0.0%,0,1,0.1%,0
comfort systems usa midsouth inc,1,0.1%,0,1,1.6%,0,0,0.0%,0
american tire distributor,1,0.1%,0,0,0.0%,0,1,0.1%,0
lexington development inc,1,0.1%,0,1,1.6%,0,0,0.0%,0
the central trust bank d/b/a central bank,1,0.1%,0,1,1.6%,0,0,0.0%,0
hydromat inc,1,0.1%,0,1,1.6%,0,0,0.0%,0
crmc and capital region medical,1,0.1%,0,1,1.6%,0,0,0.0%,0
provider plus inc,1,0.1%,0,1,1.6%,0,0,0.0%,0
cvi sgp-co acquisition trust,1,0.1%,0,1,1.6%,0,0,0.0%,0
commercial kitchen services inc a corp.,1,0.1%,0,1,1.6%,0,0,0.0%,0
job finders employment services co / broadway,1,0.1%,0,1,1.6%,0,0,0.0%,0
hittner grant a,1,0.1%,0,1,1.6%,0,0,0.0%,0