collector,count,count21,count20,percent_total,percent_total21,percent_total20,dollar_amount,dollar_amount21,dollar_amount20,dollar_percent_total,dollar_percent_total21,dollar_percent_total20,percent_with_representation,percent_with_representation21,percent_with_representation20,percent_default_judgement,percent_default_judgement21,percent_default_judgement20,percent_case_completed,percent_case_completed21,percent_case_completed20
lvnv funding llc,5010,2429,2581,29.1%,44.4%,21.9%,718420,0,718420,23.1%,0.0%,23.2%,0.9%,1.2%,0.7%,40.3%,30.7%,49.3%,76.6%,55.0%,96.9%
portfolio recovery associates llc,3388,412,2976,19.7%,7.5%,25.3%,875607,0,875607,28.2%,0.0%,28.3%,1.0%,0.7%,1.1%,59.9%,36.7%,63.1%,93.7%,56.8%,98.8%
midland funding llc,2062,43,2019,12.0%,0.8%,17.2%,356253,0,356253,11.5%,0.0%,11.5%,1.0%,0.0%,1.0%,64.4%,23.3%,65.2%,98.4%,53.5%,99.4%
midland credit management inc,1449,983,466,8.4%,18.0%,4.0%,248380,0,248380,8.0%,0.0%,8.0%,0.8%,1.0%,0.2%,42.0%,39.9%,46.4%,76.3%,65.6%,98.7%
cavalry spv i llc,1291,279,1012,7.5%,5.1%,8.6%,254175,0,254175,8.2%,0.0%,8.2%,1.0%,1.4%,0.9%,49.7%,37.6%,53.1%,92.2%,64.5%,99.8%
jefferson capital systems llc,1099,286,813,6.4%,5.2%,6.9%,185212,0,185212,6.0%,0.0%,6.0%,0.8%,0.7%,0.9%,49.6%,32.5%,55.6%,90.1%,63.3%,99.5%
credit management corporation,332,108,224,1.9%,2.0%,1.9%,18121,0,18121,0.6%,0.0%,0.6%,0.9%,0.9%,0.9%,72.3%,71.3%,72.8%,95.8%,87.0%,100.0%
crown asset management llc,259,231,28,1.5%,4.2%,0.2%,0,0,0,0.0%,0.0%,0.0%,3.5%,3.5%,3.6%,36.3%,32.9%,64.3%,59.8%,55.0%,100.0%
unifund corporation,205,14,191,1.2%,0.3%,1.6%,113757,0,113757,3.7%,0.0%,3.7%,2.0%,0.0%,2.1%,68.8%,64.3%,69.1%,98.5%,92.9%,99.0%
dnf associates llc,189,176,13,1.1%,3.2%,0.1%,1041,0,1041,0.0%,0.0%,0.0%,0.0%,0.0%,0.0%,54.5%,58.0%,7.7%,77.2%,75.6%,100.0%
second round sub llc assignee of comenity bank,160,2,158,0.9%,0.0%,1.3%,25364,0,25364,0.8%,0.0%,0.8%,1.3%,0.0%,1.3%,54.4%,0.0%,55.1%,95.6%,0.0%,96.8%
credit corp solutions inc assignee of synchrony bank,141,8,133,0.8%,0.1%,1.1%,24357,0,24357,0.8%,0.0%,0.8%,0.0%,0.0%,0.0%,23.4%,37.5%,22.6%,95.7%,75.0%,97.0%
credit corp solutions inc,120,107,13,0.7%,2.0%,0.1%,4682,0,4682,0.2%,0.0%,0.2%,0.0%,0.0%,0.0%,39.2%,37.4%,53.8%,51.7%,46.7%,92.3%
crown asset management llc assignee of comenity bank,114,4,110,0.7%,0.1%,0.9%,20792,0,20792,0.7%,0.0%,0.7%,0.9%,0.0%,0.9%,49.1%,25.0%,50.0%,93.0%,25.0%,95.5%
second round sub llc,92,64,28,0.5%,1.2%,0.2%,0,0,0,0.0%,0.0%,0.0%,0.0%,0.0%,0.0%,45.7%,29.7%,82.1%,63.0%,46.9%,100.0%
absolute resolutions investments llc,89,25,64,0.5%,0.5%,0.5%,31947,0,31947,1.0%,0.0%,1.0%,3.4%,0.0%,4.7%,55.1%,48.0%,57.8%,98.9%,96.0%,100.0%
second round sub llc assignee of comenity capital bank,89,0,89,0.5%,0.0%,0.8%,25199,0,25199,0.8%,0.0%,0.8%,0.0%,0%,0.0%,52.8%,0%,52.8%,94.4%,0%,94.4%
unifund corp.,83,22,61,0.5%,0.4%,0.5%,24357,0,24357,0.8%,0.0%,0.8%,0.0%,0.0%,0.0%,77.1%,72.7%,78.7%,98.8%,95.5%,100.0%
crown asset management llc assignee of synchrony bank,65,4,61,0.4%,0.1%,0.5%,4324,0,4324,0.1%,0.0%,0.1%,3.1%,0.0%,3.3%,53.8%,0.0%,57.4%,92.3%,50.0%,95.1%
jh met subsidiary b liquidating trust assignee of jh portfolio debt equities llc,58,54,4,0.3%,1.0%,0.0%,0,0,0,0.0%,0.0%,0.0%,5.2%,5.6%,0.0%,17.2%,14.8%,50.0%,44.8%,40.7%,100.0%
second round sub llc assignee of synchrony bank,57,0,57,0.3%,0.0%,0.5%,9243,0,9243,0.3%,0.0%,0.3%,1.8%,0%,1.8%,50.9%,0%,50.9%,96.5%,0%,96.5%
laurel wreath acquisitions llc,55,3,52,0.3%,0.1%,0.4%,24396,0,24396,0.8%,0.0%,0.8%,1.8%,0.0%,1.9%,72.7%,100.0%,71.2%,94.5%,100.0%,94.2%
discover bank,44,12,32,0.3%,0.2%,0.3%,0,0,0,0.0%,0.0%,0.0%,4.5%,8.3%,3.1%,38.6%,16.7%,46.9%,84.1%,50.0%,96.9%
second round lp assignee of synchrony bank,40,2,38,0.2%,0.0%,0.3%,6873,0,6873,0.2%,0.0%,0.2%,0.0%,0.0%,0.0%,60.0%,50.0%,60.5%,97.5%,50.0%,100.0%
crown asset management llc assignee of comenity capital bank,35,1,34,0.2%,0.0%,0.3%,6860,0,6860,0.2%,0.0%,0.2%,2.9%,0.0%,2.9%,57.1%,0.0%,58.8%,94.3%,0.0%,97.1%
cvi sgp-co acquisition trust assignee of sterling jewelers inc,34,2,32,0.2%,0.0%,0.3%,22592,0,22592,0.7%,0.0%,0.7%,0.0%,0.0%,0.0%,35.3%,0.0%,37.5%,91.2%,0.0%,96.9%
crown asset management llc assignee of citibank na,33,0,33,0.2%,0.0%,0.3%,7608,0,7608,0.2%,0.0%,0.2%,3.0%,0%,3.0%,66.7%,0%,66.7%,93.9%,0%,93.9%
franklin trust fcu,33,0,33,0.2%,0.0%,0.3%,0,0,0,0.0%,0.0%,0.0%,0.0%,0%,0.0%,42.4%,0%,42.4%,100.0%,0%,100.0%
cach llc,31,14,17,0.2%,0.3%,0.1%,750,0,750,0.0%,0.0%,0.0%,0.0%,0.0%,0.0%,51.6%,21.4%,76.5%,80.6%,57.1%,100.0%
second round lp assignee of comenity bank,30,0,30,0.2%,0.0%,0.3%,5021,0,5021,0.2%,0.0%,0.2%,0.0%,0%,0.0%,50.0%,0%,50.0%,96.7%,0%,96.7%
cvi sgp-co acquisition trust,30,0,30,0.2%,0.0%,0.3%,12079,0,12079,0.4%,0.0%,0.4%,0.0%,0%,0.0%,26.7%,0%,26.7%,100.0%,0%,100.0%
jh cx liquidating trust assignee of jh portfolio debt equities llc,29,26,3,0.2%,0.5%,0.0%,1286,0,1286,0.0%,0.0%,0.0%,0.0%,0.0%,0.0%,20.7%,19.2%,33.3%,58.6%,57.7%,66.7%
portfolio recovery associates,27,1,26,0.2%,0.0%,0.2%,0,0,0,0.0%,0.0%,0.0%,3.7%,0.0%,3.8%,63.0%,0.0%,65.4%,96.3%,100.0%,96.2%
second round lp assignee of comenity capital bank,22,0,22,0.1%,0.0%,0.2%,0,0,0,0.0%,0.0%,0.0%,0.0%,0%,0.0%,18.2%,0%,18.2%,100.0%,0%,100.0%
pca acquisitions v llc,19,17,2,0.1%,0.3%,0.0%,0,0,0,0.0%,0.0%,0.0%,5.3%,5.9%,0.0%,21.1%,11.8%,100.0%,47.4%,41.2%,100.0%
credit corp solutions inc assignee of citibank na,16,2,14,0.1%,0.0%,0.1%,1533,0,1533,0.0%,0.0%,0.0%,0.0%,0.0%,0.0%,25.0%,0.0%,28.6%,81.3%,50.0%,85.7%
pyod llc,16,16,0,0.1%,0.3%,0.0%,0,0,0,0.0%,0.0%,0.0%,0.0%,0.0%,0%,25.0%,25.0%,0%,43.8%,43.8%,0%
bailco llc,13,0,13,0.1%,0.0%,0.1%,2261,0,2261,0.1%,0.0%,0.1%,0.0%,0%,0.0%,76.9%,0%,76.9%,100.0%,0%,100.0%
first portfolio ventures i llc,13,1,12,0.1%,0.0%,0.1%,4511,0,4511,0.1%,0.0%,0.1%,0.0%,0.0%,0.0%,53.8%,100.0%,50.0%,84.6%,100.0%,83.3%
cvi sgp acquisition trust assignee of sterling jewelers inc,11,1,10,0.1%,0.0%,0.1%,1094,0,1094,0.0%,0.0%,0.0%,0.0%,0.0%,0.0%,9.1%,0.0%,10.0%,90.9%,0.0%,100.0%
pca acquisitions v llc assignee of synchrony bank,11,5,6,0.1%,0.1%,0.1%,0,0,0,0.0%,0.0%,0.0%,0.0%,0.0%,0.0%,36.4%,20.0%,50.0%,90.9%,80.0%,100.0%
crown asset management llc assignee of first national bank of omaha,10,2,8,0.1%,0.0%,0.1%,7845,0,7845,0.3%,0.0%,0.3%,0.0%,0.0%,0.0%,60.0%,50.0%,62.5%,100.0%,100.0%,100.0%
jhpde finance 1 llc assignee of citibank na,10,1,9,0.1%,0.0%,0.1%,2795,0,2795,0.1%,0.0%,0.1%,0.0%,0.0%,0.0%,40.0%,0.0%,44.4%,70.0%,0.0%,77.8%
credit corp solutions inc assignee of first electronic bank,9,0,9,0.1%,0.0%,0.1%,3531,0,3531,0.1%,0.0%,0.1%,0.0%,0%,0.0%,22.2%,0%,22.2%,88.9%,0%,88.9%
bureaus investment group portfolio no. 15 llc,8,0,8,0.0%,0.0%,0.1%,4144,0,4144,0.1%,0.0%,0.1%,0.0%,0%,0.0%,50.0%,0%,50.0%,100.0%,0%,100.0%
credit corp solutions inc assignee of webbank,8,2,6,0.0%,0.0%,0.1%,4479,0,4479,0.1%,0.0%,0.1%,0.0%,0.0%,0.0%,37.5%,100.0%,16.7%,100.0%,100.0%,100.0%
jhpde finance i llc assignee of citibank na,8,1,7,0.0%,0.0%,0.1%,3281,0,3281,0.1%,0.0%,0.1%,12.5%,0.0%,14.3%,0.0%,0.0%,0.0%,75.0%,0.0%,85.7%
cvi sgp-co acquisition trust assignee of zale delaware inc,8,2,6,0.0%,0.0%,0.1%,0,0,0,0.0%,0.0%,0.0%,0.0%,0.0%,0.0%,12.5%,0.0%,16.7%,75.0%,0.0%,100.0%
jhpde finance 1 llc,8,8,0,0.0%,0.1%,0.0%,0,0,0,0.0%,0.0%,0.0%,0.0%,0.0%,0%,37.5%,37.5%,0%,50.0%,50.0%,0%
second round lp,8,8,0,0.0%,0.1%,0.0%,0,0,0,0.0%,0.0%,0.0%,0.0%,0.0%,0%,37.5%,37.5%,0%,37.5%,37.5%,0%
webcollex llc dba cks financial assignee of worlds foremost bank,7,0,7,0.0%,0.0%,0.1%,0,0,0,0.0%,0.0%,0.0%,0.0%,0%,0.0%,57.1%,0%,57.1%,100.0%,0%,100.0%
mitchell fuel company inc,6,1,5,0.0%,0.0%,0.0%,483,0,483,0.0%,0.0%,0.0%,0.0%,0.0%,0.0%,16.7%,0.0%,20.0%,100.0%,100.0%,100.0%
waterside financial inc,6,2,4,0.0%,0.0%,0.0%,0,0,0,0.0%,0.0%,0.0%,0.0%,0.0%,0.0%,83.3%,100.0%,75.0%,100.0%,100.0%,100.0%
td bank usa na,6,5,1,0.0%,0.1%,0.0%,0,0,0,0.0%,0.0%,0.0%,0.0%,0.0%,0.0%,33.3%,20.0%,100.0%,66.7%,60.0%,100.0%
bank of america na,6,5,1,0.0%,0.1%,0.0%,0,0,0,0.0%,0.0%,0.0%,0.0%,0.0%,0.0%,50.0%,40.0%,100.0%,83.3%,80.0%,100.0%
pca acquisitions v llc assignee of citibank na,6,1,5,0.0%,0.0%,0.0%,0,0,0,0.0%,0.0%,0.0%,0.0%,0.0%,0.0%,16.7%,0.0%,20.0%,83.3%,0.0%,100.0%
bureaus investment group portfolio no 15 llc,6,6,0,0.0%,0.1%,0.0%,0,0,0,0.0%,0.0%,0.0%,0.0%,0.0%,0%,50.0%,50.0%,0%,50.0%,50.0%,0%
crown asset management llc assignee of webbank,5,0,5,0.0%,0.0%,0.0%,3471,0,3471,0.1%,0.0%,0.1%,0.0%,0%,0.0%,40.0%,0%,40.0%,100.0%,0%,100.0%
citibank na,5,1,4,0.0%,0.0%,0.0%,0,0,0,0.0%,0.0%,0.0%,0.0%,0.0%,0.0%,60.0%,100.0%,50.0%,100.0%,100.0%,100.0%
hartley & parker limited inc,5,0,5,0.0%,0.0%,0.0%,0,0,0,0.0%,0.0%,0.0%,0.0%,0%,0.0%,40.0%,0%,40.0%,100.0%,0%,100.0%
1st financial bank usa,5,0,5,0.0%,0.0%,0.0%,0,0,0,0.0%,0.0%,0.0%,0.0%,0%,0.0%,60.0%,0%,60.0%,100.0%,0%,100.0%
galaxy international purchasingllc,5,5,0,0.0%,0.1%,0.0%,0,0,0,0.0%,0.0%,0.0%,0.0%,0.0%,0%,0.0%,0.0%,0%,60.0%,60.0%,0%
jh met subsidiary a liquidating trust assignee of jh portfolio debt equities llc,5,5,0,0.0%,0.1%,0.0%,0,0,0,0.0%,0.0%,0.0%,20.0%,20.0%,0%,20.0%,20.0%,0%,40.0%,40.0%,0%
spark energy gas llc a limited liability company,4,4,0,0.0%,0.1%,0.0%,12299,12299,0,0.4%,100.0%,0.0%,0.0%,0.0%,0%,100.0%,100.0%,0%,100.0%,100.0%,0%
cvi sgp acquisition trust,4,0,4,0.0%,0.0%,0.0%,1648,0,1648,0.1%,0.0%,0.1%,0.0%,0%,0.0%,50.0%,0%,50.0%,100.0%,0%,100.0%
barclays bank delaware,4,0,4,0.0%,0.0%,0.0%,0,0,0,0.0%,0.0%,0.0%,0.0%,0%,0.0%,75.0%,0%,75.0%,100.0%,0%,100.0%
pca acquisitions v llc assignee of capital one na,4,2,2,0.0%,0.0%,0.0%,0,0,0,0.0%,0.0%,0.0%,0.0%,0.0%,0.0%,50.0%,0.0%,100.0%,100.0%,100.0%,100.0%
cavarly spv i llc,4,0,4,0.0%,0.0%,0.0%,0,0,0,0.0%,0.0%,0.0%,0.0%,0%,0.0%,50.0%,0%,50.0%,100.0%,0%,100.0%
uhg i llc,4,1,3,0.0%,0.0%,0.0%,0,0,0,0.0%,0.0%,0.0%,0.0%,0.0%,0.0%,25.0%,100.0%,0.0%,100.0%,100.0%,100.0%
credit corp solutions inc assignee of mid america,4,3,1,0.0%,0.1%,0.0%,0,0,0,0.0%,0.0%,0.0%,0.0%,0.0%,0.0%,0.0%,0.0%,0.0%,50.0%,33.3%,100.0%
resurgent receivables llc,4,4,0,0.0%,0.1%,0.0%,0,0,0,0.0%,0.0%,0.0%,0.0%,0.0%,0%,75.0%,75.0%,0%,75.0%,75.0%,0%
wellness federal credit union fka hartford healthcare,3,0,3,0.0%,0.0%,0.0%,8374,0,8374,0.3%,0.0%,0.3%,0.0%,0%,0.0%,0.0%,0%,0.0%,100.0%,0%,100.0%
jhpde finance i llc,3,3,0,0.0%,0.1%,0.0%,0,0,0,0.0%,0.0%,0.0%,0.0%,0.0%,0%,66.7%,66.7%,0%,66.7%,66.7%,0%
unifund corp,3,3,0,0.0%,0.1%,0.0%,0,0,0,0.0%,0.0%,0.0%,0.0%,0.0%,0%,100.0%,100.0%,0%,100.0%,100.0%,0%
lvnv fundingllc,2,1,1,0.0%,0.0%,0.0%,1660,0,1660,0.1%,0.0%,0.1%,0.0%,0.0%,0.0%,50.0%,0.0%,100.0%,50.0%,0.0%,100.0%
new england institute of technology,2,0,2,0.0%,0.0%,0.0%,1754,0,1754,0.1%,0.0%,0.1%,0.0%,0%,0.0%,50.0%,0%,50.0%,50.0%,0%,50.0%
jh cx liquidating trust assignee of comenity bank,2,1,1,0.0%,0.0%,0.0%,0,0,0,0.0%,0.0%,0.0%,0.0%,0.0%,0.0%,0.0%,0.0%,0.0%,50.0%,0.0%,100.0%
crown asset management llc assignee of barclays bank delaware,2,2,0,0.0%,0.0%,0.0%,0,0,0,0.0%,0.0%,0.0%,0.0%,0.0%,0%,0.0%,0.0%,0%,100.0%,100.0%,0%
jhpde finance i llc assignee of synchrony bank,2,1,1,0.0%,0.0%,0.0%,0,0,0,0.0%,0.0%,0.0%,0.0%,0.0%,0.0%,50.0%,100.0%,0.0%,100.0%,100.0%,100.0%
second round sub llc successor in interest to synchrony bank,2,0,2,0.0%,0.0%,0.0%,0,0,0,0.0%,0.0%,0.0%,0.0%,0%,0.0%,100.0%,0%,100.0%,100.0%,0%,100.0%
td bank na,2,0,2,0.0%,0.0%,0.0%,0,0,0,0.0%,0.0%,0.0%,0.0%,0%,0.0%,50.0%,0%,50.0%,100.0%,0%,100.0%
icon equities llc assignee of citibank na,2,0,2,0.0%,0.0%,0.0%,0,0,0,0.0%,0.0%,0.0%,0.0%,0%,0.0%,100.0%,0%,100.0%,100.0%,0%,100.0%
toria truck rental & leasing inc,2,0,2,0.0%,0.0%,0.0%,0,0,0,0.0%,0.0%,0.0%,0.0%,0%,0.0%,50.0%,0%,50.0%,100.0%,0%,100.0%
second round sub llc assignee of synchrony bank fka ge capital retail bank,2,0,2,0.0%,0.0%,0.0%,0,0,0,0.0%,0.0%,0.0%,0.0%,0%,0.0%,0.0%,0%,0.0%,100.0%,0%,100.0%
portfolio recovery associatesllc,2,0,2,0.0%,0.0%,0.0%,0,0,0,0.0%,0.0%,0.0%,0.0%,0%,0.0%,50.0%,0%,50.0%,100.0%,0%,100.0%
webcollex llc dba cks financial assignee of sterling jewelers,2,0,2,0.0%,0.0%,0.0%,0,0,0,0.0%,0.0%,0.0%,0.0%,0%,0.0%,0.0%,0%,0.0%,100.0%,0%,100.0%
caribbean clear,2,0,2,0.0%,0.0%,0.0%,0,0,0,0.0%,0.0%,0.0%,0.0%,0%,0.0%,0.0%,0%,0.0%,100.0%,0%,100.0%
jhpde finance 1 llc assignee of webbank,2,0,2,0.0%,0.0%,0.0%,0,0,0,0.0%,0.0%,0.0%,0.0%,0%,0.0%,50.0%,0%,50.0%,100.0%,0%,100.0%
sophia nketsiah amonoo,2,0,2,0.0%,0.0%,0.0%,0,0,0,0.0%,0.0%,0.0%,0.0%,0%,0.0%,0.0%,0%,0.0%,50.0%,0%,50.0%
wellness federal credit union fka healthcare,2,0,2,0.0%,0.0%,0.0%,0,0,0,0.0%,0.0%,0.0%,0.0%,0%,0.0%,50.0%,0%,50.0%,100.0%,0%,100.0%
cks prime investments llc assignee of webbank,2,0,2,0.0%,0.0%,0.0%,0,0,0,0.0%,0.0%,0.0%,0.0%,0%,0.0%,0.0%,0%,0.0%,100.0%,0%,100.0%
fia card services na,2,2,0,0.0%,0.0%,0.0%,0,0,0,0.0%,0.0%,0.0%,0.0%,0.0%,0%,100.0%,100.0%,0%,100.0%,100.0%,0%
rooty thomas (atomic baill bonds),2,2,0,0.0%,0.0%,0.0%,0,0,0,0.0%,0.0%,0.0%,0.0%,0.0%,0%,0.0%,0.0%,0%,100.0%,100.0%,0%
jh met subsidiary b liqui assignee of citibank na,2,2,0,0.0%,0.0%,0.0%,0,0,0,0.0%,0.0%,0.0%,0.0%,0.0%,0%,0.0%,0.0%,0%,0.0%,0.0%,0%
all waste inc,1,0,1,0.0%,0.0%,0.0%,2090,0,2090,0.1%,0.0%,0.1%,0.0%,0%,0.0%,0.0%,0%,0.0%,100.0%,0%,100.0%
second roound sub llc assignee of synchrony bank,1,0,1,0.0%,0.0%,0.0%,1044,0,1044,0.0%,0.0%,0.0%,0.0%,0%,0.0%,0.0%,0%,0.0%,100.0%,0%,100.0%
jhpde finance 1 llc assignee of synchrony bank,1,0,1,0.0%,0.0%,0.0%,2516,0,2516,0.1%,0.0%,0.1%,0.0%,0%,0.0%,100.0%,0%,100.0%,100.0%,0%,100.0%
second round lp successor in interest to synchrony bank,1,0,1,0.0%,0.0%,0.0%,3034,0,3034,0.1%,0.0%,0.1%,0.0%,0%,0.0%,100.0%,0%,100.0%,100.0%,0%,100.0%
wellness federal credit union aka hartford healthcare,1,0,1,0.0%,0.0%,0.0%,3087,0,3087,0.1%,0.0%,0.1%,0.0%,0%,0.0%,0.0%,0%,0.0%,100.0%,0%,100.0%
thomas l neal,1,0,1,0.0%,0.0%,0.0%,0,0,0,0.0%,0.0%,0.0%,0.0%,0%,0.0%,0.0%,0%,0.0%,100.0%,0%,100.0%
galaxy international purchasing llc,1,1,0,0.0%,0.0%,0.0%,0,0,0,0.0%,0.0%,0.0%,0.0%,0.0%,0%,100.0%,100.0%,0%,100.0%,100.0%,0%
seth fellman,1,1,0,0.0%,0.0%,0.0%,0,0,0,0.0%,0.0%,0.0%,0.0%,0.0%,0%,0.0%,0.0%,0%,100.0%,100.0%,0%
edco engineering inc,1,1,0,0.0%,0.0%,0.0%,0,0,0,0.0%,0.0%,0.0%,0.0%,0.0%,0%,0.0%,0.0%,0%,100.0%,100.0%,0%
mark piontkowski,1,1,0,0.0%,0.0%,0.0%,0,0,0,0.0%,0.0%,0.0%,0.0%,0.0%,0%,100.0%,100.0%,0%,100.0%,100.0%,0%
marlene gravener,1,1,0,0.0%,0.0%,0.0%,0,0,0,0.0%,0.0%,0.0%,0.0%,0.0%,0%,0.0%,0.0%,0%,100.0%,100.0%,0%
lonnie r helaire,1,1,0,0.0%,0.0%,0.0%,0,0,0,0.0%,0.0%,0.0%,0.0%,0.0%,0%,0.0%,0.0%,0%,100.0%,100.0%,0%
kim newland,1,1,0,0.0%,0.0%,0.0%,0,0,0,0.0%,0.0%,0.0%,0.0%,0.0%,0%,100.0%,100.0%,0%,100.0%,100.0%,0%
synchrony bank,1,1,0,0.0%,0.0%,0.0%,0,0,0,0.0%,0.0%,0.0%,0.0%,0.0%,0%,0.0%,0.0%,0%,100.0%,100.0%,0%
f & f distributors inc,1,1,0,0.0%,0.0%,0.0%,0,0,0,0.0%,0.0%,0.0%,0.0%,0.0%,0%,100.0%,100.0%,0%,100.0%,100.0%,0%
applied rubber & plastics inc,1,0,1,0.0%,0.0%,0.0%,0,0,0,0.0%,0.0%,0.0%,0.0%,0%,0.0%,0.0%,0%,0.0%,100.0%,0%,100.0%
bender plumbing supplies,1,0,1,0.0%,0.0%,0.0%,0,0,0,0.0%,0.0%,0.0%,0.0%,0%,0.0%,100.0%,0%,100.0%,100.0%,0%,100.0%
hartley and parker limited inc,1,0,1,0.0%,0.0%,0.0%,0,0,0,0.0%,0.0%,0.0%,0.0%,0%,0.0%,100.0%,0%,100.0%,100.0%,0%,100.0%
michael morris,1,0,1,0.0%,0.0%,0.0%,0,0,0,0.0%,0.0%,0.0%,0.0%,0%,0.0%,0.0%,0%,0.0%,100.0%,0%,100.0%
midland funding llc as successor in interest to citibank,1,0,1,0.0%,0.0%,0.0%,0,0,0,0.0%,0.0%,0.0%,0.0%,0%,0.0%,100.0%,0%,100.0%,100.0%,0%,100.0%
tmg financial services i,1,0,1,0.0%,0.0%,0.0%,0,0,0,0.0%,0.0%,0.0%,0.0%,0%,0.0%,0.0%,0%,0.0%,100.0%,0%,100.0%
crown asset management lllc,1,0,1,0.0%,0.0%,0.0%,0,0,0,0.0%,0.0%,0.0%,0.0%,0%,0.0%,0.0%,0%,0.0%,100.0%,0%,100.0%
crown asset management llc assignee of general electric capital corporation synchrony bank,1,0,1,0.0%,0.0%,0.0%,0,0,0,0.0%,0.0%,0.0%,0.0%,0%,0.0%,100.0%,0%,100.0%,100.0%,0%,100.0%
crown asset managment llc,1,0,1,0.0%,0.0%,0.0%,0,0,0,0.0%,0.0%,0.0%,0.0%,0%,0.0%,100.0%,0%,100.0%,100.0%,0%,100.0%
crown asset management llc as successor in interest to citibank na,1,0,1,0.0%,0.0%,0.0%,0,0,0,0.0%,0.0%,0.0%,0.0%,0%,0.0%,0.0%,0%,0.0%,100.0%,0%,100.0%
dattco inc,1,0,1,0.0%,0.0%,0.0%,0,0,0,0.0%,0.0%,0.0%,0.0%,0%,0.0%,0.0%,0%,0.0%,100.0%,0%,100.0%
digitire professionals llc,1,0,1,0.0%,0.0%,0.0%,0,0,0,0.0%,0.0%,0.0%,0.0%,0%,0.0%,0.0%,0%,0.0%,100.0%,0%,100.0%
york hill trap rock quarry company,1,0,1,0.0%,0.0%,0.0%,0,0,0,0.0%,0.0%,0.0%,0.0%,0%,0.0%,100.0%,0%,100.0%,100.0%,0%,100.0%
midland funding llc assignee of citibank na,1,0,1,0.0%,0.0%,0.0%,0,0,0,0.0%,0.0%,0.0%,0.0%,0%,0.0%,0.0%,0%,0.0%,100.0%,0%,100.0%
hoffman fuel company of danbury inc,1,0,1,0.0%,0.0%,0.0%,0,0,0,0.0%,0.0%,0.0%,0.0%,0%,0.0%,0.0%,0%,0.0%,100.0%,0%,100.0%
portfoliio recovery associates llc,1,0,1,0.0%,0.0%,0.0%,0,0,0,0.0%,0.0%,0.0%,0.0%,0%,0.0%,0.0%,0%,0.0%,100.0%,0%,100.0%
jefferson capital systems l,1,0,1,0.0%,0.0%,0.0%,0,0,0,0.0%,0.0%,0.0%,0.0%,0%,0.0%,0.0%,0%,0.0%,100.0%,0%,100.0%
kay management associates llc,1,0,1,0.0%,0.0%,0.0%,0,0,0,0.0%,0.0%,0.0%,0.0%,0%,0.0%,0.0%,0%,0.0%,100.0%,0%,100.0%
inc mitchell fuel company,1,0,1,0.0%,0.0%,0.0%,0,0,0,0.0%,0.0%,0.0%,0.0%,0%,0.0%,0.0%,0%,0.0%,100.0%,0%,100.0%
laurie leger,1,0,1,0.0%,0.0%,0.0%,0,0,0,0.0%,0.0%,0.0%,0.0%,0%,0.0%,0.0%,0%,0.0%,100.0%,0%,100.0%
lvnv fnding llc,1,0,1,0.0%,0.0%,0.0%,0,0,0,0.0%,0.0%,0.0%,0.0%,0%,0.0%,100.0%,0%,100.0%,100.0%,0%,100.0%
2039ct cavalry spv i llc,1,0,1,0.0%,0.0%,0.0%,0,0,0,0.0%,0.0%,0.0%,0.0%,0%,0.0%,0.0%,0%,0.0%,100.0%,0%,100.0%
smr metal technology,1,0,1,0.0%,0.0%,0.0%,0,0,0,0.0%,0.0%,0.0%,0.0%,0%,0.0%,100.0%,0%,100.0%,100.0%,0%,100.0%
capital one bank (usa) na,1,0,1,0.0%,0.0%,0.0%,0,0,0,0.0%,0.0%,0.0%,0.0%,0%,0.0%,0.0%,0%,0.0%,100.0%,0%,100.0%
northeast property group aka kay management associates llc,1,0,1,0.0%,0.0%,0.0%,0,0,0,0.0%,0.0%,0.0%,0.0%,0%,0.0%,0.0%,0%,0.0%,100.0%,0%,100.0%
cohen burns hard & paul,1,0,1,0.0%,0.0%,0.0%,0,0,0,0.0%,0.0%,0.0%,0.0%,0%,0.0%,0.0%,0%,0.0%,100.0%,0%,100.0%
porfolio recovery associates llc,1,0,1,0.0%,0.0%,0.0%,0,0,0,0.0%,0.0%,0.0%,0.0%,0%,0.0%,100.0%,0%,100.0%,100.0%,0%,100.0%
portfolio recovery assocaites llc,1,0,1,0.0%,0.0%,0.0%,0,0,0,0.0%,0.0%,0.0%,0.0%,0%,0.0%,100.0%,0%,100.0%,100.0%,0%,100.0%
portfolio recovery associtates llc,1,0,1,0.0%,0.0%,0.0%,0,0,0,0.0%,0.0%,0.0%,0.0%,0%,0.0%,100.0%,0%,100.0%,100.0%,0%,100.0%
hartley & parker limited llc,1,0,1,0.0%,0.0%,0.0%,0,0,0,0.0%,0.0%,0.0%,0.0%,0%,0.0%,100.0%,0%,100.0%,100.0%,0%,100.0%
midland funding llc successor in interest to capital one na,1,0,1,0.0%,0.0%,0.0%,0,0,0,0.0%,0.0%,0.0%,0.0%,0%,0.0%,100.0%,0%,100.0%,100.0%,0%,100.0%
midland funding llc assignee of webbank,1,0,1,0.0%,0.0%,0.0%,0,0,0,0.0%,0.0%,0.0%,0.0%,0%,0.0%,100.0%,0%,100.0%,100.0%,0%,100.0%
td bank usa n a,1,0,1,0.0%,0.0%,0.0%,0,0,0,0.0%,0.0%,0.0%,0.0%,0%,0.0%,100.0%,0%,100.0%,100.0%,0%,100.0%
tiara m. young,1,0,1,0.0%,0.0%,0.0%,0,0,0,0.0%,0.0%,0.0%,0.0%,0%,0.0%,0.0%,0%,0.0%,100.0%,0%,100.0%
midland funding llc assignee of capital one bank (usa) na,1,0,1,0.0%,0.0%,0.0%,0,0,0,0.0%,0.0%,0.0%,0.0%,0%,0.0%,100.0%,0%,100.0%,100.0%,0%,100.0%
second rlound sub llc assignee of comenity bank,1,0,1,0.0%,0.0%,0.0%,0,0,0,0.0%,0.0%,0.0%,0.0%,0%,0.0%,0.0%,0%,0.0%,100.0%,0%,100.0%
lvnv fundijng llc assignee of credit one bank na,1,0,1,0.0%,0.0%,0.0%,0,0,0,0.0%,0.0%,0.0%,0.0%,0%,0.0%,100.0%,0%,100.0%,100.0%,0%,100.0%
tri state brick of ct inc,1,0,1,0.0%,0.0%,0.0%,0,0,0,0.0%,0.0%,0.0%,0.0%,0%,0.0%,0.0%,0%,0.0%,100.0%,0%,100.0%
formisano bakery,1,0,1,0.0%,0.0%,0.0%,0,0,0,0.0%,0.0%,0.0%,0.0%,0%,0.0%,0.0%,0%,0.0%,100.0%,0%,100.0%
kathleen lewis,1,0,1,0.0%,0.0%,0.0%,0,0,0,0.0%,0.0%,0.0%,0.0%,0%,0.0%,0.0%,0%,0.0%,100.0%,0%,100.0%
david l martin jr,1,0,1,0.0%,0.0%,0.0%,0,0,0,0.0%,0.0%,0.0%,0.0%,0%,0.0%,0.0%,0%,0.0%,100.0%,0%,100.0%
pca acquisitions v llc assignee of first national bank of omaha,1,0,1,0.0%,0.0%,0.0%,0,0,0,0.0%,0.0%,0.0%,0.0%,0%,0.0%,0.0%,0%,0.0%,100.0%,0%,100.0%
north star capital acquisition llc,1,0,1,0.0%,0.0%,0.0%,0,0,0,0.0%,0.0%,0.0%,0.0%,0%,0.0%,0.0%,0%,0.0%,100.0%,0%,100.0%
second roundlp assignee of synchrony bank,1,0,1,0.0%,0.0%,0.0%,0,0,0,0.0%,0.0%,0.0%,0.0%,0%,0.0%,100.0%,0%,100.0%,100.0%,0%,100.0%
lvnv funding,1,0,1,0.0%,0.0%,0.0%,0,0,0,0.0%,0.0%,0.0%,0.0%,0%,0.0%,0.0%,0%,0.0%,100.0%,0%,100.0%
midland credit mangement llc,1,0,1,0.0%,0.0%,0.0%,0,0,0,0.0%,0.0%,0.0%,0.0%,0%,0.0%,0.0%,0%,0.0%,100.0%,0%,100.0%
crown asset management llc assignee of santander consumer usa inc,1,0,1,0.0%,0.0%,0.0%,0,0,0,0.0%,0.0%,0.0%,0.0%,0%,0.0%,0.0%,0%,0.0%,100.0%,0%,100.0%
london london,1,0,1,0.0%,0.0%,0.0%,0,0,0,0.0%,0.0%,0.0%,0.0%,0%,0.0%,0.0%,0%,0.0%,100.0%,0%,100.0%
jh cx liquidating trust assignee of comenity capital bank,1,0,1,0.0%,0.0%,0.0%,0,0,0,0.0%,0.0%,0.0%,0.0%,0%,0.0%,0.0%,0%,0.0%,100.0%,0%,100.0%
jh cx liquidating trust assignee of bluestem,1,0,1,0.0%,0.0%,0.0%,0,0,0,0.0%,0.0%,0.0%,0.0%,0%,0.0%,0.0%,0%,0.0%,100.0%,0%,100.0%
l. suzio asphalt company inc,1,0,1,0.0%,0.0%,0.0%,0,0,0,0.0%,0.0%,0.0%,100.0%,0%,100.0%,0.0%,0%,0.0%,100.0%,0%,100.0%
musicmakers llc,1,0,1,0.0%,0.0%,0.0%,0,0,0,0.0%,0.0%,0.0%,0.0%,0%,0.0%,0.0%,0%,0.0%,100.0%,0%,100.0%
jefferson capital systems llc v,1,0,1,0.0%,0.0%,0.0%,0,0,0,0.0%,0.0%,0.0%,0.0%,0%,0.0%,0.0%,0%,0.0%,100.0%,0%,100.0%
absolute resolutions investmnents llc,1,0,1,0.0%,0.0%,0.0%,0,0,0,0.0%,0.0%,0.0%,0.0%,0%,0.0%,100.0%,0%,100.0%,100.0%,0%,100.0%
cava;ry spv i llc,1,0,1,0.0%,0.0%,0.0%,0,0,0,0.0%,0.0%,0.0%,0.0%,0%,0.0%,0.0%,0%,0.0%,100.0%,0%,100.0%
stonehedge landscaping co. inc,1,0,1,0.0%,0.0%,0.0%,0,0,0,0.0%,0.0%,0.0%,0.0%,0%,0.0%,0.0%,0%,0.0%,100.0%,0%,100.0%
midland funing llc,1,0,1,0.0%,0.0%,0.0%,0,0,0,0.0%,0.0%,0.0%,0.0%,0%,0.0%,0.0%,0%,0.0%,100.0%,0%,100.0%
a. gallo & company,1,0,1,0.0%,0.0%,0.0%,0,0,0,0.0%,0.0%,0.0%,100.0%,0%,100.0%,0.0%,0%,0.0%,100.0%,0%,100.0%
richard rodriguez,1,0,1,0.0%,0.0%,0.0%,0,0,0,0.0%,0.0%,0.0%,0.0%,0%,0.0%,0.0%,0%,0.0%,100.0%,0%,100.0%
american express national bank,1,1,0,0.0%,0.0%,0.0%,0,0,0,0.0%,0.0%,0.0%,0.0%,0.0%,0%,0.0%,0.0%,0%,0.0%,0.0%,0%
razor capital llc,1,1,0,0.0%,0.0%,0.0%,0,0,0,0.0%,0.0%,0.0%,0.0%,0.0%,0%,0.0%,0.0%,0%,100.0%,100.0%,0%
jacqueline eady,1,1,0,0.0%,0.0%,0.0%,0,0,0,0.0%,0.0%,0.0%,0.0%,0.0%,0%,0.0%,0.0%,0%,0.0%,0.0%,0%
galasso materials llc,1,1,0,0.0%,0.0%,0.0%,0,0,0,0.0%,0.0%,0.0%,0.0%,0.0%,0%,0.0%,0.0%,0%,0.0%,0.0%,0%
first financial investment fund iii llc,1,1,0,0.0%,0.0%,0.0%,0,0,0,0.0%,0.0%,0.0%,0.0%,0.0%,0%,0.0%,0.0%,0%,0.0%,0.0%,0%
hartford wellness federal credit union aka hartford healthcare,1,1,0,0.0%,0.0%,0.0%,0,0,0,0.0%,0.0%,0.0%,0.0%,0.0%,0%,0.0%,0.0%,0%,100.0%,100.0%,0%
hartford wellness federal credit union aka hartford healtcare,1,1,0,0.0%,0.0%,0.0%,0,0,0,0.0%,0.0%,0.0%,0.0%,0.0%,0%,100.0%,100.0%,0%,100.0%,100.0%,0%
alfonzo stokes jr,1,1,0,0.0%,0.0%,0.0%,0,0,0,0.0%,0.0%,0.0%,0.0%,0.0%,0%,100.0%,100.0%,0%,100.0%,100.0%,0%
julie roberts,1,1,0,0.0%,0.0%,0.0%,0,0,0,0.0%,0.0%,0.0%,0.0%,0.0%,0%,100.0%,100.0%,0%,100.0%,100.0%,0%
arlene wright,1,1,0,0.0%,0.0%,0.0%,0,0,0,0.0%,0.0%,0.0%,0.0%,0.0%,0%,0.0%,0.0%,0%,100.0%,100.0%,0%
wagner pereira damotta,1,0,1,0.0%,0.0%,0.0%,0,0,0,0.0%,0.0%,0.0%,0.0%,0%,0.0%,0.0%,0%,0.0%,100.0%,0%,100.0%
zuleyka acosta,1,1,0,0.0%,0.0%,0.0%,0,0,0,0.0%,0.0%,0.0%,0.0%,0.0%,0%,0.0%,0.0%,0%,100.0%,100.0%,0%
laurie j leger,1,1,0,0.0%,0.0%,0.0%,0,0,0,0.0%,0.0%,0.0%,0.0%,0.0%,0%,0.0%,0.0%,0%,100.0%,100.0%,0%
pinewood landscaping llc,1,0,1,0.0%,0.0%,0.0%,0,0,0,0.0%,0.0%,0.0%,0.0%,0%,0.0%,0.0%,0%,0.0%,100.0%,0%,100.0%
jonna szczawinski,1,0,1,0.0%,0.0%,0.0%,0,0,0,0.0%,0.0%,0.0%,0.0%,0%,0.0%,0.0%,0%,0.0%,100.0%,0%,100.0%
rosalind rotundo,1,0,1,0.0%,0.0%,0.0%,0,0,0,0.0%,0.0%,0.0%,100.0%,0%,100.0%,0.0%,0%,0.0%,100.0%,0%,100.0%
crowley auto group,1,0,1,0.0%,0.0%,0.0%,0,0,0,0.0%,0.0%,0.0%,0.0%,0%,0.0%,0.0%,0%,0.0%,100.0%,0%,100.0%
rose ahenkorah,1,0,1,0.0%,0.0%,0.0%,0,0,0,0.0%,0.0%,0.0%,0.0%,0%,0.0%,0.0%,0%,0.0%,0.0%,0%,0.0%
cach llc assignee of mid america bank and trust company,1,0,1,0.0%,0.0%,0.0%,0,0,0,0.0%,0.0%,0.0%,0.0%,0%,0.0%,0.0%,0%,0.0%,0.0%,0%,0.0%
cvi sgp acquistion trust,1,0,1,0.0%,0.0%,0.0%,0,0,0,0.0%,0.0%,0.0%,0.0%,0%,0.0%,0.0%,0%,0.0%,100.0%,0%,100.0%
sterling jewelers inc d/b/a kay jewelers,1,0,1,0.0%,0.0%,0.0%,0,0,0,0.0%,0.0%,0.0%,0.0%,0%,0.0%,0.0%,0%,0.0%,100.0%,0%,100.0%
jh met subsidiary b liquidating trust,1,0,1,0.0%,0.0%,0.0%,0,0,0,0.0%,0.0%,0.0%,0.0%,0%,0.0%,0.0%,0%,0.0%,100.0%,0%,100.0%
jefferson capital systems llcv,1,0,1,0.0%,0.0%,0.0%,0,0,0,0.0%,0.0%,0.0%,0.0%,0%,0.0%,0.0%,0%,0.0%,100.0%,0%,100.0%
midland credit managem,1,0,1,0.0%,0.0%,0.0%,0,0,0,0.0%,0.0%,0.0%,0.0%,0%,0.0%,0.0%,0%,0.0%,100.0%,0%,100.0%
hartford florist supply,1,1,0,0.0%,0.0%,0.0%,0,0,0,0.0%,0.0%,0.0%,0.0%,0.0%,0%,0.0%,0.0%,0%,100.0%,100.0%,0%
eleanor m. cooper,1,1,0,0.0%,0.0%,0.0%,0,0,0,0.0%,0.0%,0.0%,0.0%,0.0%,0%,0.0%,0.0%,0%,100.0%,100.0%,0%
anthony reyes,1,1,0,0.0%,0.0%,0.0%,0,0,0,0.0%,0.0%,0.0%,0.0%,0.0%,0%,100.0%,100.0%,0%,100.0%,100.0%,0%
harte collision center,1,1,0,0.0%,0.0%,0.0%,0,0,0,0.0%,0.0%,0.0%,0.0%,0.0%,0%,0.0%,0.0%,0%,100.0%,100.0%,0%
jh cx liquidating trust assignee of citibank na,1,1,0,0.0%,0.0%,0.0%,0,0,0,0.0%,0.0%,0.0%,0.0%,0.0%,0%,0.0%,0.0%,0%,0.0%,0.0%,0%
cach llc assignee of capital one na,1,1,0,0.0%,0.0%,0.0%,0,0,0,0.0%,0.0%,0.0%,0.0%,0.0%,0%,0.0%,0.0%,0%,0.0%,0.0%,0%
tracy j. burke,1,0,1,0.0%,0.0%,0.0%,0,0,0,0.0%,0.0%,0.0%,0.0%,0%,0.0%,0.0%,0%,0.0%,0.0%,0%,0.0%
connecticut distributors inc,1,0,1,0.0%,0.0%,0.0%,0,0,0,0.0%,0.0%,0.0%,0.0%,0%,0.0%,0.0%,0%,0.0%,0.0%,0%,0.0%
indiana members credit union,1,0,1,0.0%,0.0%,0.0%,0,0,0,0.0%,0.0%,0.0%,0.0%,0%,0.0%,0.0%,0%,0.0%,100.0%,0%,100.0%
roush michael g,1,0,1,0.0%,0.0%,0.0%,0,0,0,0.0%,0.0%,0.0%,0.0%,0%,0.0%,0.0%,0%,0.0%,100.0%,0%,100.0%
credit acceptance corp.,1,1,0,0.0%,0.0%,0.0%,0,0,0,0.0%,0.0%,0.0%,0.0%,0.0%,0%,0.0%,0.0%,0%,0.0%,0.0%,0%