collector,count,count21,count20,percent_total,percent_total21,percent_total20,dollar_amount,dollar_amount21,dollar_amount20,dollar_percent_total,dollar_percent_total21,dollar_percent_total20,percent_with_representation,percent_with_representation21,percent_with_representation20,percent_default_judgement,percent_default_judgement21,percent_default_judgement20,percent_case_completed,percent_case_completed21,percent_case_completed20
lvnv funding llc,706,345,361,29.7%,42.3%,23.1%,54736,0,54736,20.3%,0%,20.3%,2.0%,3.2%,0.8%,58.8%,50.1%,67.0%,95.9%,92.5%,99.2%
portfolio recovery associates llc,404,55,349,17.0%,6.7%,22.3%,64695,0,64695,24.0%,0%,24.0%,2.2%,5.5%,1.7%,66.8%,38.2%,71.3%,98.5%,89.1%,100.0%
midland funding llc,279,2,277,11.7%,0.2%,17.7%,20559,0,20559,7.6%,0%,7.6%,1.1%,50.0%,0.7%,71.3%,0.0%,71.8%,100.0%,100.0%,100.0%
cavalry spv i llc,219,75,144,9.2%,9.2%,9.2%,23783,0,23783,8.8%,0%,8.8%,11.4%,30.7%,1.4%,56.6%,40.0%,65.3%,91.8%,76.0%,100.0%
midland credit management inc,209,149,60,8.8%,18.3%,3.8%,25091,0,25091,9.3%,0%,9.3%,1.0%,1.3%,0.0%,62.2%,63.8%,58.3%,96.2%,94.6%,100.0%
jefferson capital systems llc,141,26,115,5.9%,3.2%,7.3%,20253,0,20253,7.5%,0%,7.5%,0.0%,0.0%,0.0%,67.4%,69.2%,67.0%,99.3%,96.2%,100.0%
crown asset management llc,52,41,11,2.2%,5.0%,0.7%,0,0,0,0.0%,0%,0.0%,50.0%,53.7%,36.4%,30.8%,29.3%,36.4%,86.5%,82.9%,100.0%
unifund corporation,34,1,33,1.4%,0.1%,2.1%,15266,0,15266,5.7%,0%,5.7%,2.9%,0.0%,3.0%,85.3%,100.0%,84.8%,100.0%,100.0%,100.0%
credit management corporation,34,16,18,1.4%,2.0%,1.1%,0,0,0,0.0%,0%,0.0%,2.9%,6.3%,0.0%,67.6%,56.3%,77.8%,94.1%,87.5%,100.0%
second round sub llc assignee of comenity bank,27,1,26,1.1%,0.1%,1.7%,4915,0,4915,1.8%,0%,1.8%,3.7%,0.0%,3.8%,48.1%,0.0%,50.0%,100.0%,100.0%,100.0%
absolute resolutions investments llc,22,3,19,0.9%,0.4%,1.2%,0,0,0,0.0%,0%,0.0%,13.6%,33.3%,10.5%,72.7%,66.7%,73.7%,100.0%,100.0%,100.0%
dnf associates llc,21,21,0,0.9%,2.6%,0.0%,0,0,0,0.0%,0%,0.0%,9.5%,9.5%,0%,66.7%,66.7%,0%,90.5%,90.5%,0%
unifund corp.,19,6,13,0.8%,0.7%,0.8%,10479,0,10479,3.9%,0%,3.9%,0.0%,0.0%,0.0%,78.9%,100.0%,69.2%,100.0%,100.0%,100.0%
credit corp solutions inc assignee of synchrony bank,16,0,16,0.7%,0.0%,1.0%,5291,0,5291,2.0%,0%,2.0%,0.0%,0%,0.0%,56.3%,0%,56.3%,100.0%,0%,100.0%
laurel wreath acquisitions llc,12,2,10,0.5%,0.2%,0.6%,11001,0,11001,4.1%,0%,4.1%,0.0%,0.0%,0.0%,75.0%,100.0%,70.0%,100.0%,100.0%,100.0%
credit corp solutions inc,12,9,3,0.5%,1.1%,0.2%,0,0,0,0.0%,0%,0.0%,0.0%,0.0%,0.0%,91.7%,88.9%,100.0%,100.0%,100.0%,100.0%
crown asset management llc assignee of synchrony bank,11,2,9,0.5%,0.2%,0.6%,0,0,0,0.0%,0%,0.0%,0.0%,0.0%,0.0%,63.6%,100.0%,55.6%,100.0%,100.0%,100.0%
crown asset management llc assignee of comenity bank,10,1,9,0.4%,0.1%,0.6%,0,0,0,0.0%,0%,0.0%,0.0%,0.0%,0.0%,60.0%,0.0%,66.7%,100.0%,100.0%,100.0%
jh met subsidiary b liquidating trust assignee of jh portfolio debt equities llc,9,9,0,0.4%,1.1%,0.0%,0,0,0,0.0%,0%,0.0%,0.0%,0.0%,0%,55.6%,55.6%,0%,88.9%,88.9%,0%
second round sub llc,9,9,0,0.4%,1.1%,0.0%,0,0,0,0.0%,0%,0.0%,22.2%,22.2%,0%,55.6%,55.6%,0%,77.8%,77.8%,0%
second round sub llc assignee of comenity capital bank,8,0,8,0.3%,0.0%,0.5%,0,0,0,0.0%,0%,0.0%,12.5%,0%,12.5%,62.5%,0%,62.5%,100.0%,0%,100.0%
crown asset management llc assignee of comenity capital bank,7,0,7,0.3%,0.0%,0.4%,1988,0,1988,0.7%,0%,0.7%,28.6%,0%,28.6%,42.9%,0%,42.9%,100.0%,0%,100.0%
second round lp assignee of comenity bank,7,0,7,0.3%,0.0%,0.4%,719,0,719,0.3%,0%,0.3%,0.0%,0%,0.0%,42.9%,0%,42.9%,100.0%,0%,100.0%
second round lp assignee of synchrony bank,7,0,7,0.3%,0.0%,0.4%,0,0,0,0.0%,0%,0.0%,0.0%,0%,0.0%,85.7%,0%,85.7%,100.0%,0%,100.0%
pyod llc,6,6,0,0.3%,0.7%,0.0%,0,0,0,0.0%,0%,0.0%,0.0%,0.0%,0%,33.3%,33.3%,0%,100.0%,100.0%,0%
discover bank,5,2,3,0.2%,0.2%,0.2%,3868,0,3868,1.4%,0%,1.4%,20.0%,0.0%,33.3%,60.0%,100.0%,33.3%,100.0%,100.0%,100.0%
crown asset management llc assignee of citibank na,5,0,5,0.2%,0.0%,0.3%,0,0,0,0.0%,0%,0.0%,0.0%,0%,0.0%,40.0%,0%,40.0%,100.0%,0%,100.0%
pca acquisitions v llc,5,5,0,0.2%,0.6%,0.0%,0,0,0,0.0%,0%,0.0%,40.0%,40.0%,0%,60.0%,60.0%,0%,100.0%,100.0%,0%
jhpde finance 1 llc assignee of citibank na,4,2,2,0.2%,0.2%,0.1%,1729,0,1729,0.6%,0%,0.6%,0.0%,0.0%,0.0%,50.0%,50.0%,50.0%,75.0%,50.0%,100.0%
pca acquisitions v llc assignee of synchrony bank,4,2,2,0.2%,0.2%,0.1%,0,0,0,0.0%,0%,0.0%,50.0%,50.0%,50.0%,25.0%,50.0%,0.0%,100.0%,100.0%,100.0%
cach llc,4,3,1,0.2%,0.4%,0.1%,0,0,0,0.0%,0%,0.0%,0.0%,0.0%,0.0%,75.0%,66.7%,100.0%,100.0%,100.0%,100.0%
pca acquisitions v llc assignee of capital one na,4,1,3,0.2%,0.1%,0.2%,0,0,0,0.0%,0%,0.0%,0.0%,0.0%,0.0%,25.0%,0.0%,33.3%,100.0%,100.0%,100.0%
second round lp assignee of comenity capital bank,4,0,4,0.2%,0.0%,0.3%,0,0,0,0.0%,0%,0.0%,0.0%,0%,0.0%,100.0%,0%,100.0%,100.0%,0%,100.0%
f & f distributors inc,3,3,0,0.1%,0.4%,0.0%,0,0,0,0.0%,0%,0.0%,0.0%,0.0%,0%,33.3%,33.3%,0%,66.7%,66.7%,0%
portfolio recovery associates,3,1,2,0.1%,0.1%,0.1%,0,0,0,0.0%,0%,0.0%,0.0%,0.0%,0.0%,33.3%,0.0%,50.0%,100.0%,100.0%,100.0%
pca acquisitions v llc assignee of citibank na,3,0,3,0.1%,0.0%,0.2%,0,0,0,0.0%,0%,0.0%,66.7%,0%,66.7%,33.3%,0%,33.3%,100.0%,0%,100.0%
bank of america na,3,3,0,0.1%,0.4%,0.0%,0,0,0,0.0%,0%,0.0%,0.0%,0.0%,0%,0.0%,0.0%,0%,66.7%,66.7%,0%
first portfolio ventures i llc,2,1,1,0.1%,0.1%,0.1%,0,0,0,0.0%,0%,0.0%,0.0%,0.0%,0.0%,50.0%,0.0%,100.0%,100.0%,100.0%,100.0%
jh cx liquidating trust assignee of jh portfolio debt equities llc,2,2,0,0.1%,0.2%,0.0%,0,0,0,0.0%,0%,0.0%,0.0%,0.0%,0%,100.0%,100.0%,0%,100.0%,100.0%,0%
waterside financial inc,2,0,2,0.1%,0.0%,0.1%,0,0,0,0.0%,0%,0.0%,0.0%,0%,0.0%,100.0%,0%,100.0%,100.0%,0%,100.0%
second round sub llc assignee of synchrony bank,2,0,2,0.1%,0.0%,0.1%,0,0,0,0.0%,0%,0.0%,0.0%,0%,0.0%,100.0%,0%,100.0%,100.0%,0%,100.0%
barclays bank delaware,2,0,2,0.1%,0.0%,0.1%,0,0,0,0.0%,0%,0.0%,0.0%,0%,0.0%,50.0%,0%,50.0%,100.0%,0%,100.0%
cvi sgp-co acquisition trust assignee of sterling jewelers inc,2,0,2,0.1%,0.0%,0.1%,0,0,0,0.0%,0%,0.0%,0.0%,0%,0.0%,100.0%,0%,100.0%,100.0%,0%,100.0%
cvi sgp acquisition trust assignee of sterling jewelers inc,2,0,2,0.1%,0.0%,0.1%,0,0,0,0.0%,0%,0.0%,0.0%,0%,0.0%,100.0%,0%,100.0%,100.0%,0%,100.0%
uhg i llc,2,0,2,0.1%,0.0%,0.1%,0,0,0,0.0%,0%,0.0%,0.0%,0%,0.0%,100.0%,0%,100.0%,100.0%,0%,100.0%
hartley & parker limited inc,2,0,2,0.1%,0.0%,0.1%,0,0,0,0.0%,0%,0.0%,0.0%,0%,0.0%,50.0%,0%,50.0%,50.0%,0%,50.0%
spark energy gas llc,1,0,1,0.0%,0.0%,0.1%,5693,0,5693,2.1%,0%,2.1%,0.0%,0%,0.0%,100.0%,0%,100.0%,100.0%,0%,100.0%
spark energy gas llc a limited liability company,1,1,0,0.0%,0.1%,0.0%,0,0,0,0.0%,0%,0.0%,0.0%,0.0%,0%,0.0%,0.0%,0%,0.0%,0.0%,0%
bender plumbing supply,1,0,1,0.0%,0.0%,0.1%,0,0,0,0.0%,0%,0.0%,0.0%,0%,0.0%,100.0%,0%,100.0%,100.0%,0%,100.0%
jh cx liquidating trust assignee of comenity bank,1,0,1,0.0%,0.0%,0.1%,0,0,0,0.0%,0%,0.0%,0.0%,0%,0.0%,100.0%,0%,100.0%,100.0%,0%,100.0%
citibank na,1,0,1,0.0%,0.0%,0.1%,0,0,0,0.0%,0%,0.0%,100.0%,0%,100.0%,0.0%,0%,0.0%,100.0%,0%,100.0%
wfs earth materials,1,1,0,0.0%,0.1%,0.0%,0,0,0,0.0%,0%,0.0%,0.0%,0.0%,0%,0.0%,0.0%,0%,100.0%,100.0%,0%
bureaus investment group portfolio no. 15 llc,1,1,0,0.0%,0.1%,0.0%,0,0,0,0.0%,0%,0.0%,0.0%,0.0%,0%,0.0%,0.0%,0%,100.0%,100.0%,0%
membersfirst ct fcu,1,1,0,0.0%,0.1%,0.0%,0,0,0,0.0%,0%,0.0%,0.0%,0.0%,0%,100.0%,100.0%,0%,100.0%,100.0%,0%
bureaus investment group assignee of capital one na,1,0,1,0.0%,0.0%,0.1%,0,0,0,0.0%,0%,0.0%,0.0%,0%,0.0%,100.0%,0%,100.0%,100.0%,0%,100.0%
crown asset management llc assigneee of comenity bank,1,0,1,0.0%,0.0%,0.1%,0,0,0,0.0%,0%,0.0%,0.0%,0%,0.0%,100.0%,0%,100.0%,100.0%,0%,100.0%
cvam llc d/b/a/ glastonbury water systems,1,0,1,0.0%,0.0%,0.1%,0,0,0,0.0%,0%,0.0%,0.0%,0%,0.0%,100.0%,0%,100.0%,100.0%,0%,100.0%
lisa b. flagge d/b/a long hill oil,1,0,1,0.0%,0.0%,0.1%,0,0,0,0.0%,0%,0.0%,0.0%,0%,0.0%,100.0%,0%,100.0%,100.0%,0%,100.0%
franklin trust fcu,1,0,1,0.0%,0.0%,0.1%,0,0,0,0.0%,0%,0.0%,0.0%,0%,0.0%,100.0%,0%,100.0%,100.0%,0%,100.0%
the leader store,1,0,1,0.0%,0.0%,0.1%,0,0,0,0.0%,0%,0.0%,0.0%,0%,0.0%,100.0%,0%,100.0%,100.0%,0%,100.0%
capital one bank (usa) na,1,0,1,0.0%,0.0%,0.1%,0,0,0,0.0%,0%,0.0%,0.0%,0%,0.0%,100.0%,0%,100.0%,100.0%,0%,100.0%
nutmeg state finc credit union,1,0,1,0.0%,0.0%,0.1%,0,0,0,0.0%,0%,0.0%,0.0%,0%,0.0%,100.0%,0%,100.0%,100.0%,0%,100.0%
portofolio recovery associates llc,1,0,1,0.0%,0.0%,0.1%,0,0,0,0.0%,0%,0.0%,0.0%,0%,0.0%,100.0%,0%,100.0%,100.0%,0%,100.0%
bailco llc,1,0,1,0.0%,0.0%,0.1%,0,0,0,0.0%,0%,0.0%,0.0%,0%,0.0%,0.0%,0%,0.0%,100.0%,0%,100.0%
second round sub llc successor in interest to synchrony bank,1,0,1,0.0%,0.0%,0.1%,0,0,0,0.0%,0%,0.0%,0.0%,0%,0.0%,0.0%,0%,0.0%,100.0%,0%,100.0%
webcollex llc dba cks financial assignee of worlds foremost bank,1,0,1,0.0%,0.0%,0.1%,0,0,0,0.0%,0%,0.0%,0.0%,0%,0.0%,100.0%,0%,100.0%,100.0%,0%,100.0%
crown asset management llc assignee of first national bank of omaha,1,0,1,0.0%,0.0%,0.1%,0,0,0,0.0%,0%,0.0%,0.0%,0%,0.0%,100.0%,0%,100.0%,100.0%,0%,100.0%
credit corp soluitons inc assignee of synchrony bank,1,0,1,0.0%,0.0%,0.1%,0,0,0,0.0%,0%,0.0%,0.0%,0%,0.0%,100.0%,0%,100.0%,100.0%,0%,100.0%
cvi sgp-co acquisition trust,1,0,1,0.0%,0.0%,0.1%,0,0,0,0.0%,0%,0.0%,0.0%,0%,0.0%,100.0%,0%,100.0%,100.0%,0%,100.0%
jh cx liquidating trust assignee of bluestem,1,0,1,0.0%,0.0%,0.1%,0,0,0,0.0%,0%,0.0%,0.0%,0%,0.0%,0.0%,0%,0.0%,100.0%,0%,100.0%
crown asset management llc assignee of webbank,1,0,1,0.0%,0.0%,0.1%,0,0,0,0.0%,0%,0.0%,0.0%,0%,0.0%,100.0%,0%,100.0%,100.0%,0%,100.0%
jhpde finance 1 llc assignee of synchrony bank,1,0,1,0.0%,0.0%,0.1%,0,0,0,0.0%,0%,0.0%,0.0%,0%,0.0%,100.0%,0%,100.0%,100.0%,0%,100.0%
lupis bakery,1,0,1,0.0%,0.0%,0.1%,0,0,0,0.0%,0%,0.0%,0.0%,0%,0.0%,0.0%,0%,0.0%,100.0%,0%,100.0%
g&g beverage distributorsinc,1,0,1,0.0%,0.0%,0.1%,0,0,0,0.0%,0%,0.0%,0.0%,0%,0.0%,100.0%,0%,100.0%,100.0%,0%,100.0%
bmw of north haven,1,1,0,0.0%,0.1%,0.0%,0,0,0,0.0%,0%,0.0%,0.0%,0.0%,0%,0.0%,0.0%,0%,0.0%,0.0%,0%
key acquistions,1,1,0,0.0%,0.1%,0.0%,0,0,0,0.0%,0%,0.0%,0.0%,0.0%,0%,0.0%,0.0%,0%,100.0%,100.0%,0%
td bank usa na,1,1,0,0.0%,0.1%,0.0%,0,0,0,0.0%,0%,0.0%,100.0%,100.0%,0%,0.0%,0.0%,0%,100.0%,100.0%,0%
jhpde finance 1 llc,1,1,0,0.0%,0.1%,0.0%,0,0,0,0.0%,0%,0.0%,100.0%,100.0%,0%,0.0%,0.0%,0%,100.0%,100.0%,0%
antoine damas,1,1,0,0.0%,0.1%,0.0%,0,0,0,0.0%,0%,0.0%,0.0%,0.0%,0%,0.0%,0.0%,0%,100.0%,100.0%,0%
icon equities llc,1,1,0,0.0%,0.1%,0.0%,0,0,0,0.0%,0%,0.0%,0.0%,0.0%,0%,0.0%,0.0%,0%,100.0%,100.0%,0%
nemcomed fw llc doing business as avaign instruments and implants division,1,1,0,0.0%,0.1%,0.0%,0,0,0,0.0%,0%,0.0%,0.0%,0.0%,0%,0.0%,0.0%,0%,0.0%,0.0%,0%