collector,count,count21,count20,percent_total,percent_total21,percent_total20,dollar_amount,dollar_amount21,dollar_amount20,dollar_percent_total,dollar_percent_total21,dollar_percent_total20,percent_with_representation,percent_with_representation21,percent_with_representation20,percent_default_judgement,percent_default_judgement21,percent_default_judgement20,percent_case_completed,percent_case_completed21,percent_case_completed20
HANNIBAL REGIONAL HOSPITAL,7,0,7,0.13,0.0,0.14,0,0,0,0.0,0.0,0.0,0.0,0.0,0.0,0.43,0.0,0.43,1.0,0.0,1.0
MOBERLY HOSPITAL COMPANY LLC,7,1,6,0.13,0.14,0.12,0,0,0,0.0,0.0,0.0,0.0,0.0,0.0,0.14,0.0,0.17,1.0,1.0,1.0
LVNV FUNDING LLC,7,1,6,0.13,0.14,0.12,0,0,0,0.0,0.0,0.0,0.0,0.0,0.0,0.0,0.0,0.0,1.0,1.0,1.0
KIRKSVILLE MISSOURI HOSPITAL COMPANY LLC,5,1,4,0.089,0.14,0.082,0,0,0,0.0,0.0,0.0,0.0,0.0,0.0,0.0,0.0,0.0,1.0,1.0,1.0
MIDLAND FUNDING LLC,5,0,5,0.089,0.0,0.10,0,0,0,0.0,0.0,0.0,0.0,0.0,0.0,0.0,0.0,0.0,1.0,0.0,1.0
HANNIBAL CLINIC OPERATIONS LLC,4,0,4,0.071,0.0,0.082,0,0,0,0.0,0.0,0.0,0.0,0.0,0.0,0.75,0.0,0.75,1.0,0.0,1.0
MIDLAND CREDIT MANAGEMENT INC,4,0,4,0.071,0.0,0.082,0,0,0,0.0,0.0,0.0,0.0,0.0,0.0,0.0,0.0,0.0,1.0,0.0,1.0
PORTFOLIO RECOVERY ASSOCIATES LLC,4,0,4,0.071,0.0,0.082,0,0,0,0.0,0.0,0.0,0.0,0.0,0.0,0.0,0.0,0.0,1.0,0.0,1.0
WAKEFIELD & ASSOCIATES INC,2,0,2,0.036,0.0,0.041,0,0,0,0.0,0.0,0.0,0.0,0.0,0.0,0.0,0.0,0.0,1.0,0.0,1.0
MOBERLY HOSPITAL COMPANY LLC D/B/A MOBERLY REGIONAL MED,1,0,1,0.018,0.0,0.020,0,0,0,0.0,0.0,0.0,0.0,0.0,0.0,0.0,0.0,0.0,1.0,0.0,1.0
CAVALRY SPV I LLC,1,0,1,0.018,0.0,0.020,0,0,0,0.0,0.0,0.0,0.0,0.0,0.0,1.0,0.0,1.0,1.0,0.0,1.0
BANK OF AMERICA,1,0,1,0.018,0.0,0.020,0,0,0,0.0,0.0,0.0,1.0,0.0,1.0,0.0,0.0,0.0,1.0,0.0,1.0
TD BANK USA NA,1,0,1,0.018,0.0,0.020,0,0,0,0.0,0.0,0.0,1.0,0.0,1.0,0.0,0.0,0.0,1.0,0.0,1.0
WAKEFIELD AND ASSOCIATES INC,1,0,1,0.018,0.0,0.020,0,0,0,0.0,0.0,0.0,0.0,0.0,0.0,0.0,0.0,0.0,1.0,0.0,1.0
KIRKSVILLE MO HOSPITAL,1,0,1,0.018,0.0,0.020,0,0,0,0.0,0.0,0.0,0.0,0.0,0.0,0.0,0.0,0.0,1.0,0.0,1.0
JEFFERSON CAPITAL SYSTEMS LLC,1,0,1,0.018,0.0,0.020,0,0,0,0.0,0.0,0.0,0.0,0.0,0.0,0.0,0.0,0.0,1.0,0.0,1.0
MOBERLY HOSPITAL CO LLC DBA MOBERLY REGIONAL MEDICAL,1,1,0,0.018,0.14,0.0,0,0,0,0.0,0.0,0.0,0.0,0.0,0.0,0.0,0.0,0.0,1.0,1.0,0.0
CITIBANK N A,1,1,0,0.018,0.14,0.0,0,0,0,0.0,0.0,0.0,0.0,0.0,0.0,0.0,0.0,0.0,1.0,1.0,0.0
TOGETHER CREDIT UNION F/K/A ANHEUSER-BUSCH EMPLOYEES CREDIT,1,1,0,0.018,0.14,0.0,0,0,0,0.0,0.0,0.0,0.0,0.0,0.0,0.0,0.0,0.0,1.0,1.0,0.0
NCB MANAGEMENT SERVICES INC,1,1,0,0.018,0.14,0.0,0,0,0,0.0,0.0,0.0,0.0,0.0,0.0,0.0,0.0,0.0,1.0,1.0,0.0